Name,Gender,"Rating Value","Rating Count","Main Accords",Perfumers,Description,url
"Vasilisa Prekrasnaya Василиса Прекрасная Brocardfor women","for women",3.95,230,"['sweet', 'fruity', 'balsamic', 'amber', 'honey', 'woody', 'warm spicy', 'coffee', 'earthy', 'mossy']","['Olaf Larsen']","Vasilisa Prekrasnaya Василиса ПрекраснаяbyBrocardis a Amber Woody fragrance for women. This is a new fragrance.Vasilisa Prekrasnaya Василиса Прекраснаяwas launched in 2022. The nose behind this fragrance is Olaf Larsen.",https://www.fragrantica.com/perfume/Brocard/Vasilisa-Prekrasnaya-Vasilisa-Prekrasnaa-78519.html
"Midnight Fleur Soleil Nestfor women and men","for women and men",3.78,23,"['floral', 'sweet', 'tropical', 'fruity', 'woody', 'white floral', 'fresh', 'aquatic', 'ozonic']",[],"Midnight Fleur SoleilbyNestis a Amber Floral fragrance for women and men.Midnight Fleur Soleilwas launched in 2015.",https://www.fragrantica.com/perfume/Nest/Midnight-Fleur-Soleil-31758.html
"Pure Luck Lady Secrets Linn Youngfor women","for women",4,2,"['cacao', 'vanilla', 'warm spicy', 'sweet', 'woody', 'fruity', 'patchouli', 'white floral', 'powdery', 'balsamic']",[],"Pure Luck Lady SecretsbyLinn Youngis a Amber Floral fragrance for women.Pure Luck Lady Secretswas launched in 2018. Top notes are Orange Blossom and Woodsy Notes; middle notes are Vanilla and Raspberry; base notes are Cacao and Patchouli.",https://www.fragrantica.com/perfume/Linn-Young/Pure-Luck-Lady-Secrets-72501.html
"Vanille Framboise Laurence Dumontfor women","for women",3.48,31,"['fruity', 'sweet', 'rose', 'vanilla', 'citrus', 'white floral', 'floral']",[],"Vanille FramboisebyLaurence Dumontis a Floral Fruity fragrance for women.Vanille Framboisewas launched in 2010. Top notes are Amalfi Lemon and Pear; middle notes are Rose and Jasmine; base notes are Raspberry and Vanille.",https://www.fragrantica.com/perfume/Laurence-Dumont/Vanille-Framboise-9254.html
"Pink Sugar Paradise Perfumes and Gemsfor women and men","for women and men",,,"['sweet', 'caramel', 'powdery', 'citrus', 'fruity', 'vanilla', 'violet']",[],"Pink SugarbyParadise Perfumes and Gemsis a Amber fragrance for women and men.Pink Sugarwas launched in 2017.",https://www.fragrantica.com/perfume/Paradise-Perfumes-and-Gems/Pink-Sugar-59173.html
"Jamaica Paolo Giglifor women and men","for women and men",4.33,3,"['marine', 'citrus', 'aromatic', 'tobacco', 'aquatic', 'woody', 'sweet', 'white floral', 'fresh']",[],"JamaicabyPaolo Gigliis a Woody Aromatic fragrance for women and men. Top notes are Seaweed, Lemon and Pine; middle notes are Jasmine, Cedar and Rose; base notes are Tobacco, Sandalwood, Agarwood (Oud) and Patchouli.",https://www.fragrantica.com/perfume/Paolo-Gigli/Jamaica-15677.html
"Emporio Armani Stronger With You Oud Giorgio Armanifor men","for men",4.3,479,"['vanilla', 'oud', 'lavender', 'fresh spicy', 'powdery', 'sweet', 'aromatic']","['Cecile Matton']","Emporio Armani Stronger With You OudbyGiorgio Armaniis a Woody Aromatic fragrance for men. This is a new fragrance.Emporio Armani Stronger With You Oudwas launched in 2022. The nose behind this fragrance is Cecile Matton.",https://www.fragrantica.com/perfume/Giorgio-Armani/Emporio-Armani-Stronger-With-You-Oud-76171.html
"Nights of Japan The Dua Brandfor women and men","for women and men",4,1,"['woody', 'aromatic', 'earthy', 'amber', 'citrus', 'white floral', 'patchouli', 'leather', 'animalic', 'green']",[],"Nights of JapanbyThe Dua Brandis a Woody Spicy fragrance for women and men.Nights of Japanwas launched in 2021.",https://www.fragrantica.com/perfume/The-Dua-Brand/Nights-of-Japan-86420.html
"Pleasure Rose Aroma Essencefor women","for women",5,1,"['rose', 'floral', 'white floral', 'fresh']",[],"Pleasure RosebyAroma Essenceis a Floral Aquatic fragrance for women.",https://www.fragrantica.com/perfume/Aroma-Essence/Pleasure-Rose-48669.html
"Crème Brulee Demeter Fragrancefor women and men","for women and men",4.12,25,"['sweet', 'caramel', 'lactonic']",[],"Crème BruleebyDemeter Fragranceis a fragrance for women and men.",https://www.fragrantica.com/perfume/Demeter-Fragrance/Creme-Brulee-19914.html
"Beguiling (Breathless) Avonfor women","for women",3.96,24,"['amber', 'aromatic', 'balsamic', 'aldehydic', 'warm spicy', 'smoky', 'yellow floral', 'sweet', 'fresh spicy', 'mossy']",[],"Beguiling (Breathless)byAvonis a fragrance for women.Beguiling (Breathless)was launched in 1987. Top notes are Aldehydes, Ylang-Ylang and Bergamot; middle notes are Coriander, Jasmine and Basil; base notes are Incense, Myrrh and Oakmoss.",https://www.fragrantica.com/perfume/Avon/Beguiling-Breathless-39275.html
"Musc Patchouly Adopt Parfumsfor women and men","for women and men",4,8,"['citrus', 'patchouli', 'musky', 'woody', 'white floral', 'warm spicy', 'powdery', 'sweet', 'earthy', 'balsamic']","['Dominique Monlun']","Musc PatchoulybyAdopt Parfumsis a Amber fragrance for women and men. The nose behind this fragrance is Dominique Monlun. Top notes are Bergamot, Orange and Mandarin Orange; middle notes are Orange Blossom and Peach; base notes are Patchouli and Musk.",https://www.fragrantica.com/perfume/Adopt-Parfums/Musc-Patchouly-34797.html
"Aromania Bergamot Faberlicfor women","for women",3.95,94,"['citrus', 'fresh spicy', 'aromatic']","['Evelyne Boulanger']","Aromania BergamotbyFaberlicis a Citrus fragrance for women.Aromania Bergamotwas launched in 2017. The nose behind this fragrance is Evelyne Boulanger.",https://www.fragrantica.com/perfume/Faberlic/Aromania-Bergamot-46553.html
"O d'Azur Lancômefor women","for women",3.92,"1,991","['citrus', 'floral', 'rose', 'fresh', 'musky', 'aromatic', 'woody', 'soft spicy', 'fresh spicy']","['Domitille Michalon Bertier', 'Sophie Labbé']","O d'AzurbyLancômeis a Floral Fruity fragrance for women.O d'Azurwas launched in 2010. O d'Azur was created by Domitille Michalon Bertier and Sophie Labbe. Top notes are Amalfi Lemon and Bergamot; middle notes are Peony, Rose and Pink Pepper; base notes are Musk, Woodsy Notes and Ambrette (Musk Mallow).",https://www.fragrantica.com/perfume/Lancome/O-d-Azur-8859.html
"Legni & Spezie L'Amandefor women","for women",4,1,"['aromatic', 'herbal', 'amber', 'soft spicy', 'citrus', 'warm spicy', 'woody']",[],"Legni & SpeziebyL'Amandeis a fragrance for women. This is a new fragrance.Legni & Speziewas launched in 2023. Top note is Citruses; middle notes are Sage and Cardamom; base notes are Amber and Cedar.",https://www.fragrantica.com/perfume/L-Amande/Legni-Spezie-88787.html
"Peau de Peche Keiko Mecherifor women","for women",4.04,790,"['powdery', 'woody', 'fruity', 'musky', 'iris', 'amber']",[],"Peau de PechebyKeiko Mecheriis a Floral Woody Musk fragrance for women.Peau de Pechewas launched in 2003.",https://www.fragrantica.com/perfume/Keiko-Mecheri/Peau-de-Peche-2709.html
"White Magik A Perfume Organicfor women and men","for women and men",3.33,9,"['musky', 'amber', 'powdery', 'white floral', 'aromatic', 'herbal']","['Amanda Walker']","White MagikbyA Perfume Organicis a Floral fragrance for women and men.White Magikwas launched in 2010. The nose behind this fragrance is Amanda Walker.",https://www.fragrantica.com/perfume/A-Perfume-Organic/White-Magik-8054.html
"Velvet Tonka BDK Parfumsfor women and men","for women and men",3.69,"1,358","['vanilla', 'sweet', 'almond', 'amber', 'nutty', 'fruity', 'woody', 'aromatic', 'tobacco', 'white floral']","['Alexandra Carlin']","Velvet TonkabyBDK Parfumsis a Floral fragrance for women and men.Velvet Tonkawas launched in 2021. The nose behind this fragrance is Alexandra Carlin. Top notes are Almond and Orange Blossom; middle notes are Tobacco and Rose Oil; base notes are Tonka Bean, Bourbon Vanilla, Amberwood and Amyris.",https://www.fragrantica.com/perfume/BDK-Parfums/Velvet-Tonka-68119.html
"Portiolli Celebrate 10 Anos Jequitifor men","for men",4,1,"['fresh spicy', 'aromatic', 'amber', 'woody', 'lavender', 'citrus', 'warm spicy', 'herbal', 'rose', 'vanilla']","['Leonardo Lucheze']","Portiolli Celebrate 10 AnosbyJequitiis a Amber fragrance for men. This is a new fragrance.Portiolli Celebrate 10 Anoswas launched in 2023. The nose behind this fragrance is Leonardo Lucheze. Top notes are Lemon, Lavender and Black Pepper; middle notes are Geranium, Nutmeg and Sandalwood; base notes are Amber, Tonka Bean and Cedar.",https://www.fragrantica.com/perfume/Jequiti/Portiolli-Celebrate-10-Anos-83686.html
"Patchouli Queen Bfor women and men","for women and men",4.17,6,"['warm spicy', 'patchouli', 'amber', 'woody', 'earthy', 'balsamic']",[],"PatchoulibyQueen Bis a Amber Woody fragrance for women and men.",https://www.fragrantica.com/perfume/Queen-B/Patchouli-23134.html
"Royale Crown Flaviafor women and men","for women and men",4.6,10,"['woody', 'amber', 'earthy', 'powdery', 'aromatic', 'sweet', 'iris', 'mossy', 'citrus', 'vanilla']",[],"Royale CrownbyFlaviais a fragrance for women and men. Top notes are Pineapple and Bergamot; middle notes are Iris, Cinnamon and Jasmine; base notes are Virginia Cedar, Oakmoss, Amber, Vetiver, Vanilla and Labdanum.",https://www.fragrantica.com/perfume/Flavia/Royale-Crown-85215.html
"Lacoste Lacoste Fragrancesfor men","for men",4.16,542,"['aromatic', 'citrus', 'fresh spicy', 'green', 'woody', 'earthy', 'mossy', 'lavender', 'herbal', 'floral']",[],"LacostebyLacoste Fragrancesis a Woody Aromatic fragrance for men.Lacostewas launched in 1984. Top notes are Lime, Lavender, Bergamot, Lemon and Clary Sage; middle notes are Basil, Green Notes, Geranium, Jasmine, Carnation and Galbanum; base notes are Oakmoss, Vetiver, Cedar, Musk, Tonka Bean and Amber.",https://www.fragrantica.com/perfume/Lacoste-Fragrances/Lacoste-671.html
"AMBR B The Perfumistfor women and men","for women and men",4.33,12,[],[],"AMBR BbyThe Perfumistis a fragrance for women and men.AMBR Bwas launched in 2018.",https://www.fragrantica.com/perfume/The-Perfumist/AMBR-B-53219.html
"Lilac Giovanna Babyfor women","for women",4.3,46,"['lavender', 'musky', 'white floral', 'sweet', 'yellow floral', 'powdery', 'aromatic', 'woody', 'soft spicy', 'fresh spicy']",[],"LilacbyGiovanna Babyis a Floral fragrance for women.Lilacwas launched in 2012. Top notes are Citrus and Floral Notes and Anise; middle notes are Lavender, Ylang-Ylang, Lily and Jasmine; base notes are White Musk, Vanilla and Woody Notes.",https://www.fragrantica.com/perfume/Giovanna-Baby/Lilac-34621.html
"DKNY Be Delicious Coconuts About Summer Donna Karanfor women","for women",3.93,229,"['coconut', 'musky', 'sweet', 'floral', 'lactonic', 'tropical', 'vanilla', 'powdery', 'nutty']",[],"DKNY Be Delicious Coconuts About SummerbyDonna Karanis a Floral Fruity fragrance for women.DKNY Be Delicious Coconuts About Summerwas launched in 2021. Top note is Coconut Nectar; middle note is Magnolia; base note is White Musk.",https://www.fragrantica.com/perfume/Donna-Karan/DKNY-Be-Delicious-Coconuts-About-Summer-65552.html
"Blosson Tinny Blosson Villefor women","for women",5,1,"['floral', 'lavender', 'woody', 'fresh', 'herbal', 'aromatic', 'fresh spicy']",[],"Blosson TinnybyBlosson Villeis a Floral fragrance for women.Blosson Tinnywas launched in 2012. Top note is Lavender; middle note is Wildflowers; base note is Woodsy Notes.",https://www.fragrantica.com/perfume/Blosson-Ville/Blosson-Tinny-72207.html
"Puķu zirnītis (Душистый горошек) Dzintarsfor women","for women",4.33,3,"['white floral', 'amber', 'yellow floral', 'powdery', 'sweet', 'woody', 'fresh', 'citrus', 'rose', 'floral']","['Milda Gulbe']","Puķu zirnītis (Душистый горошек)byDzintarsis a Floral fragrance for women.Puķu zirnītis (Душистый горошек)was launched in 1959. The nose behind this fragrance is Milda Gulbe. Top notes are Citruses, Lily-of-the-Valley and Lime (Linden) Blossom; middle notes are Ylang-Ylang, Jasmine and Rose; base notes are Amber, Sandalwood and Tolu Balsam.",https://www.fragrantica.com/perfume/Dzintars/Puku-zirnitis-Dusistyj-gorosek-61276.html
"A Wish Lonkoom Parfumfor women","for women",3.85,27,"['sweet', 'vanilla', 'fruity', 'white floral', 'fresh', 'tropical', 'woody', 'powdery', 'citrus', 'tuberose']",[],"A WishbyLonkoom Parfumis a Floral Fruity fragrance for women.A Wishwas launched in 2015. Top notes are Passionfruit, Pear, Orange, Aldehydes and Grapefruit; middle notes are Jasmine, Tuberose, Rose and Lily-of-the-Valley; base notes are Vanilla, Sandalwood, Patchouli, Vetiver, Musk, Sodium Silicate and Cedar.",https://www.fragrantica.com/perfume/Lonkoom-Parfum/A-Wish-38764.html
"Air (Воздух) Acidica Perfumesfor women and men","for women and men",3.71,7,"['woody', 'warm spicy', 'powdery', 'rose', 'white floral', 'earthy']","['Elena Markova']","Air (Воздух)byAcidica Perfumesis a Amber Floral fragrance for women and men.Air (Воздух)was launched in 2018. The nose behind this fragrance is Elena Markova.",https://www.fragrantica.com/perfume/Acidica-Perfumes/Air-Vozduh-54009.html
"Fleurs de Bulgarie Creedfor women","for women",3.93,304,"['rose', 'musky', 'amber', 'animalic', 'citrus', 'powdery', 'floral']","['Henry Creed Third Generation', 'Pierre Bourdon']","Fleurs de BulgariebyCreedis a Floral fragrance for women.Fleurs de Bulgariewas launched in 1845. Fleurs de Bulgarie was created by Henry Creed Third Generation and Pierre Bourdon. Top note is Bergamot; middle note is Bulgarian Rose; base notes are Musk and Ambergris.",https://www.fragrantica.com/perfume/Creed/Fleurs-de-Bulgarie-4251.html
"Imperial Leather Welton Londonfor women and men","for women and men",4.6,5,"['leather', 'sweet', 'amber', 'vanilla', 'warm spicy', 'aromatic', 'animalic', 'woody', 'floral', 'soft spicy']","['Christian Provenzano']","Imperial LeatherbyWelton Londonis a Amber Woody fragrance for women and men. This is a new fragrance.Imperial Leatherwas launched in 2024. The nose behind this fragrance is Christian Provenzano. Top notes are Saffron, Pink Pepper, Grapefruit, Davana, Rosemary and Bergamot; middle notes are Leather, Magnolia, Brown sugar, Raspberry and Oud; base notes are Amber, Vanilla, Vetiver and Patchouli.",https://www.fragrantica.com/perfume/Welton-London/Imperial-Leather-90898.html
"Amberful Mancerafor women and men","for women and men",3.93,27,"['woody', 'citrus', 'amber', 'fresh spicy', 'powdery', 'green', 'floral', 'soft spicy', 'sweet']",[],"AmberfulbyMancerais a Amber fragrance for women and men. This is a new fragrance.Amberfulwas launched in 2024. Top notes are Yuzu, Calabrian bergamot, Pink Pepper and Nutmeg; middle notes are Amberwood, Patchouli and Violet; base notes are Cedar, Amber and Moss.",https://www.fragrantica.com/perfume/Mancera/Amberful-93337.html
"Parfum des Merveilles 2006 Hermèsfor women","for women",4.16,19,"['woody', 'amber', 'citrus', 'balsamic', 'earthy', 'patchouli', 'warm spicy', 'mossy', 'fresh', 'green']","['Jean-Claude Ellena', 'Ralf Schwieger']","Parfum des Merveilles 2006byHermèsis a Amber Woody fragrance for women.Parfum des Merveilles 2006was launched in 2006. Parfum des Merveilles 2006 was created by Jean-Claude Ellena and Ralf Schwieger.",https://www.fragrantica.com/perfume/Hermes/Parfum-des-Merveilles-2006-5864.html
"No14 Rossetto Pradafor women","for women",4.38,53,"['powdery', 'sweet', 'fruity', 'vanilla', 'rose', 'violet', 'floral', 'musky', 'almond', 'fresh']","['Daniela (Roche) Andrier']","No14 RossettobyPradais a Floral Fruity fragrance for women.No14 Rossettowas launched in 2012. The nose behind this fragrance is Daniela (Roche) Andrier. Top notes are Raspberry, Pineapple and Aldehydes; middle notes are Rose, Violet and Cherry; base notes are Heliotrope, Vanilla and Musk.",https://www.fragrantica.com/perfume/Prada/No14-Rossetto-17171.html
"Rose Bath & Body Worksfor women","for women",4.3,223,"['rose', 'musky', 'floral', 'white floral', 'powdery']",[],"RosebyBath & Body Worksis a Floral fragrance for women.Rosewas launched in 2019.",https://www.fragrantica.com/perfume/Bath-Body-Works/Rose-77526.html
"1962 Florisfor women and men","for women and men",4.31,191,"['aromatic', 'woody', 'fresh spicy', 'green', 'citrus', 'mossy', 'warm spicy', 'earthy']",[],"1962byFlorisis a Citrus fragrance for women and men.1962was launched in 2016. Top notes are Peppermint, Cloves, Green Mandarin and Bergamot; middle notes are Cypress, Basil, Jasmine and Lily-of-the-Valley; base notes are Moss, Cedar, Amber and Musk.",https://www.fragrantica.com/perfume/Floris/1962-40919.html
"Delicious Blossom 2017 zarafor women","for women",4,17,"['citrus', 'fruity', 'musky', 'powdery', 'sweet']",[],"Delicious Blossom 2017byzarais a fragrance for women.Delicious Blossom 2017was launched in 2017. Top note is Mandarin Orange; middle note is Peach; base note is Musk.",https://www.fragrantica.com/perfume/zara/Delicious-Blossom-2017-46183.html
"Rosa O'Livia Inspiração Botânicafor women and men","for women and men",5,1,"['fresh spicy', 'aromatic', 'leather', 'white floral', 'oud', 'citrus', 'fruity', 'animalic', 'rose', 'herbal']",[],"RosabyO'Livia Inspiração Botânicais a Chypre Floral fragrance for women and men. This is a new fragrance.Rosawas launched in 2022. Top notes are Bergamot, Jasmine and Geranium; middle note is Red Fruits; base notes are Agarwood (Oud) and Leather.",https://www.fragrantica.com/perfume/O-Livia-Inspiracao-Botanica/Rosa-72540.html
"Revelation Energy Pierre Cardinfor men","for men",4.06,17,"['fruity', 'woody', 'fresh', 'citrus', 'powdery', 'sweet', 'leather', 'white floral', 'green', 'violet']",[],"Revelation EnergybyPierre Cardinis a Amber Woody fragrance for men.Revelation Energywas launched in 2007. Top notes are Pineapple, Tangerine, Green Apple, Cassia and Bergamot; middle notes are Violet, Jasmine, May Rose and Lily-of-the-Valley; base notes are Leather, Sandalwood, Teak Wood, Amber and Musk.",https://www.fragrantica.com/perfume/Pierre-Cardin/Revelation-Energy-2603.html
"Bergamota O'Livia Inspiração Botânicafor women and men","for women and men",,,"['citrus', 'fresh spicy', 'aromatic', 'white floral']",[],"BergamotabyO'Livia Inspiração Botânicais a Citrus Aromatic fragrance for women and men. This is a new fragrance.Bergamotawas launched in 2022. Top notes are Bergamot and Pomelo; middle note is Graperfuit; base notes are Orange Blossom and Rosemary.",https://www.fragrantica.com/perfume/O-Livia-Inspiracao-Botanica/Bergamota-72528.html
"Angel Arty 2017 Muglerfor women","for women",4.22,18,"['sweet', 'fruity', 'patchouli', 'warm spicy', 'vanilla', 'woody', 'fresh', 'floral', 'chocolate', 'tropical']",[],"Angel Arty 2017byMugleris a Amber Vanilla fragrance for women.Angel Arty 2017was launched in 2017. Top notes are Melon, Mandarin Orange, Jasmine and Cassia; middle notes are Blackberry, Orchid, Tropical Fruits and Honey; base notes are Patchouli, Dark Chocolate, Tonka Bean, Caramel and Vanilla.",https://www.fragrantica.com/perfume/Mugler/Angel-Arty-2017-48075.html
"Crown Gold Dkhoon Emiratesfor women and men","for women and men",5,4,"['amber', 'musky', 'oud', 'vanilla', 'powdery', 'animalic', 'sweet']",[],"Crown GoldbyDkhoon Emiratesis a Amber Vanilla fragrance for women and men.Crown Goldwas launched in 2021. Top note is Agarwood (Oud); middle note is Vanilla; base notes are Musk and Amber.",https://www.fragrantica.com/perfume/Dkhoon-Emirates/Crown-Gold-76482.html
"Cataliya Maïssa Parfumsfor women and men","for women and men",3.58,48,"['fruity', 'citrus', 'woody', 'aromatic', 'sweet', 'vanilla', 'musky', 'soft spicy', 'powdery', 'caramel']",[],"CataliyabyMaïssa Parfumsis a Amber fragrance for women and men.Cataliyawas launched in 2020. Top notes are Black Currant, Plum, Lemon and Grapefruit; middle notes are Caramel, Patchouli and Vetiver; base notes are Vanilla, Musk and Amber.",https://www.fragrantica.com/perfume/Maissa-Parfums/Cataliya-68570.html
"Delicious Vanilla In The Boxfor women and men","for women and men",2.43,23,"['vanilla', 'fruity', 'sweet', 'almond', 'lactonic', 'caramel', 'nutty', 'powdery', 'fresh', 'balsamic']",[],"Delicious VanillabyIn The Boxis a Amber Vanilla fragrance for women and men.Delicious Vanillawas launched in 2021. Top notes are Milk, Almond and Red Fruits; middle note is Caramel; base note is Madagascar Vanilla.",https://www.fragrantica.com/perfume/In-The-Box/Delicious-Vanilla-71764.html
"Surrounding Thread Zarafor women","for women",3.71,17,"['white floral', 'musky', 'powdery', 'iris', 'violet', 'floral', 'earthy']",[],"Surrounding ThreadbyZarais a Floral fragrance for women.Surrounding Threadwas launched in 2019. Top note is Iris; middle note is Jasmine; base note is Musk.",https://www.fragrantica.com/perfume/Zara/Surrounding-Thread-54395.html
"Litchi Galimardfor women and men","for women and men",,,"['fruity', 'tropical', 'fresh', 'aquatic']",[],"LitchibyGalimardis a fragrance for women and men.Litchiwas launched in 2021.",https://www.fragrantica.com/perfume/Galimard/Litchi-93283.html
"Aud Junaid Junaid Perfumesfor women and men","for women and men",4.17,6,"['oud', 'fresh spicy']",[],"Aud JunaidbyJunaid Perfumesis a Amber Woody fragrance for women and men.",https://www.fragrantica.com/perfume/Junaid-Perfumes/Aud-Junaid-22432.html
"Plague FUMparFUMfor women and men","for women and men",4.2,5,[],"['Aistis Mickevičius']","PlaguebyFUMparFUMis a fragrance for women and men.Plaguewas launched in 2021. The nose behind this fragrance is Aistis Mickevičius.",https://www.fragrantica.com/perfume/FUMparFUM/Plague-69605.html
"Orchid Avonfor women","for women",,,[],[],"OrchidbyAvonis a Floral fragrance for women.",https://www.fragrantica.com/perfume/Avon/Orchid-27466.html
"Love Spell Untamed Victoria's Secretfor women","for women",4.08,49,"['fruity', 'sweet', 'aquatic', 'lactonic', 'powdery']",[],"Love Spell UntamedbyVictoria's Secretis a Floral Fruity fragrance for women.Love Spell Untamedwas launched in 2021.",https://www.fragrantica.com/perfume/Victoria-s-Secret/Love-Spell-Untamed-70960.html
"Faconnable Homme Façonnablefor men","for men",3.54,28,"['aromatic', 'woody', 'marine', 'powdery', 'musky', 'rose', 'green', 'white floral', 'fresh spicy', 'aquatic']",[],"Faconnable HommebyFaçonnableis a Aromatic Fougere fragrance for men.Faconnable Hommewas launched in 2000. Top notes are Sea Notes, Mint, Jasmine, Melon, Mandarin Orange and Orange Blossom; middle notes are Pelargonium, Damask Rose and Cedar; base notes are Musk, Sandalwood, Amber and Bourbon Vanilla.",https://www.fragrantica.com/perfume/Faconnable/Faconnable-Homme-5631.html
"Tam Dao Eau de Parfum Diptyquefor women and men","for women and men",4.14,"2,009","['woody', 'powdery', 'warm spicy', 'aromatic']","['Daniel Moliere']","Tam Dao Eau de ParfumbyDiptyqueis a Woody fragrance for women and men.Tam Dao Eau de Parfumwas launched in 2013. The nose behind this fragrance is Daniel Moliere.",https://www.fragrantica.com/perfume/Diptyque/Tam-Dao-Eau-de-Parfum-49104.html
"Oud Bouquet Eau de Parfum Lancômefor women and men","for women and men",4.21,"1,536","['sweet', 'oud', 'vanilla', 'rose', 'warm spicy', 'lactonic', 'metallic', 'nutty', 'leather', 'powdery']",[],"Oud Bouquet Eau de ParfumbyLancômeis a Amber Vanilla fragrance for women and men.Oud Bouquet Eau de Parfumwas launched in 2014.",https://www.fragrantica.com/perfume/Lancome/Oud-Bouquet-Eau-de-Parfum-26776.html
"Lullaby Francesca dell'Orofor women","for women",3.76,169,"['vanilla', 'coconut', 'floral', 'sweet', 'lactonic', 'powdery', 'fruity', 'musky', 'tropical', 'soft spicy']",[],"LullabybyFrancesca dell'Orois a Floral Fruity fragrance for women.Lullabywas launched in 2013. Top notes are Coconut, Tangerine, Red Apple, Bergamot, Banana and Peach; middle notes are Osmanthus, Hibiscus, Iris, Tahitian Gardenia and Lily; base notes are Vanilla, Musk, Ambergris, Davana, Oak and Whipped Cream.",https://www.fragrantica.com/perfume/Francesca-dell-Oro/Lullaby-30211.html
"Eau du Soir 2021 Edition Pop and Wild Sisleyfor women","for women",4.09,11,"['woody', 'warm spicy', 'floral', 'fresh spicy', 'citrus', 'aromatic', 'earthy', 'mossy', 'patchouli', 'yellow floral']",[],"Eau du Soir 2021 Edition Pop and WildbySisleyis a Chypre Floral fragrance for women.Eau du Soir 2021 Edition Pop and Wildwas launched in 2021. Eau du Soir 2021 Edition Pop and Wild was created by Hubert d'Ornano, Isabelle d'Ornano and Jeannine Mongin. Top notes are Grapefruit and Mandarin Orange; middle notes are Carnation, Moss, Patchouli, Iris, Juniper, Ylang-Ylang, Pepper, Rose, Jasmine, Labdanum, Lily-of-the-Valley and Syringa; base notes are Amber and Musk.",https://www.fragrantica.com/perfume/Sisley/Eau-du-Soir-2021-Edition-Pop-and-Wild-69596.html
"Dynamix Power Bi-esfor men","for men",2,5,"['woody', 'aromatic', 'aquatic', 'citrus', 'warm spicy', 'mossy', 'leather', 'earthy']",[],"Dynamix PowerbyBi-esis a Woody Aromatic fragrance for men. Top notes are Cedar Needles, Guatemalan Cardamom and Yellow Mandarin; middle notes are Coriander, Water Notes and Woody Notes; base notes are Guaiac Wood, Leather and Moss.",https://www.fragrantica.com/perfume/Bi-es/Dynamix-Power-30444.html
"Royal Prince Women Jean-Pierre Sandfor women","for women",,,"['white floral', 'citrus', 'amber', 'woody', 'powdery', 'fruity', 'sweet', 'animalic']",[],"Royal Prince WomenbyJean-Pierre Sandis a Floral Fruity fragrance for women. Top notes are Peach and Lemon; middle notes are Jasmine and Orange Blossom; base notes are Amber and Sandalwood.",https://www.fragrantica.com/perfume/Jean-Pierre-Sand/Royal-Prince-Women-27636.html
"Vert Boheme Tom Fordfor women and men","for women and men",3.84,463,"['green', 'ozonic', 'floral', 'white floral', 'citrus', 'aquatic', 'aromatic', 'fruity', 'woody', 'balsamic']","['Olivier Gillotin']","Vert BohemebyTom Fordis a Floral Green fragrance for women and men.Vert Bohemewas launched in 2016. The nose behind this fragrance is Olivier Gillotin.",https://www.fragrantica.com/perfume/Tom-Ford/Vert-Boheme-40091.html
