Name,Gender,"Rating Value","Rating Count","Main Accords",Perfumers,Description,url
"Apple Brandy on the Rocks By Kilianfor women and men","for women and men",4.11,"2,505","['fruity', 'woody', 'warm spicy', 'fresh', 'rum', 'sweet', 'green', 'amber', 'vanilla', 'aromatic']","['Sidonie Lancesseur']","Apple Brandy on the RocksbyBy Kilianis a Aromatic Fruity fragrance for women and men.Apple Brandy on the Rockswas launched in 2021. The nose behind this fragrance is Sidonie Lancesseur. Top notes are Cardamom and Bergamot; middle notes are Apple, Rum, Brandy, Pineapple, Vanilla and Moss; base notes are Ambroxan and Cedar.",https://www.fragrantica.com/perfume/By-Kilian/Apple-Brandy-on-the-Rocks-68326.html
"Samba Viva Woman Perfumer's Workshopfor women","for women",2.71,7,"['citrus', 'white floral', 'fresh spicy', 'floral', 'sweet']",[],"Samba Viva WomanbyPerfumer's Workshopis a Floral Fruity fragrance for women.Samba Viva Womanwas launched in 2003. Top notes are Bergamot, Orange, Apple Blossom, Pear and Fruits; middle notes are Jasmine, Pepper and Rose; base notes are Vanilla and Cedar.",https://www.fragrantica.com/perfume/Perfumer-s-Workshop/Samba-Viva-Woman-30303.html
"Liberty Nuancielofor women and men","for women and men",4.16,57,"['white floral', 'lavender', 'aromatic', 'vanilla', 'fruity', 'citrus', 'sweet', 'musky', 'powdery', 'soft spicy']",[],"LibertybyNuancielois a Amber Fougere fragrance for women and men.Libertywas launched in 2021. Top notes are Lavender, Black Currant, Cassis, Petitgrain and Tangerine; middle notes are Lavender, Orange Blossom and Jasmine; base notes are Madagascar Vanilla, Musk, Ambergris and Cedar.",https://www.fragrantica.com/perfume/Nuancielo/Liberty-71574.html
"Oudh Arboreal Alkemia Perfumesfor women and men","for women and men",4.5,8,"['amber', 'woody', 'warm spicy', 'aromatic', 'oud', 'balsamic', 'green', 'patchouli', 'sweet', 'powdery']","['Sharra Lamoureaux']","Oudh ArborealbyAlkemia Perfumesis a fragrance for women and men. The nose behind this fragrance is Sharra Lamoureaux.",https://www.fragrantica.com/perfume/Alkemia-Perfumes/Oudh-Arboreal-54063.html
"Shining Estiarafor men","for men",4,1,"['aromatic', 'woody', 'citrus', 'powdery', 'white floral', 'fresh spicy', 'earthy', 'musky', 'mossy', 'iris']",[],"ShiningbyEstiarais a Woody Aromatic fragrance for men. Top notes are Lemon, Petitgrain and Rosemary; middle notes are Jasmine, Orris and Coriander; base notes are Cedar, Moss and Musk.",https://www.fragrantica.com/perfume/Estiara/Shining-27792.html
"Titanium Eau de Cologne Natural Scentsfor men","for men",4,2,[],[],"Titanium Eau de ColognebyNatural Scentsis a Aromatic fragrance for men.",https://www.fragrantica.com/perfume/Natural-Scents/Titanium-Eau-de-Cologne-37357.html
"Violette Précieuse Caronfor women","for women",3.9,49,"['powdery', 'violet', 'iris', 'white floral', 'woody', 'fresh', 'musky', 'fruity', 'floral', 'sweet']","['Ernest Daltroff']","Violette PrécieusebyCaronis a Floral fragrance for women.Violette Précieusewas launched in 2018. The nose behind this fragrance is Ernest Daltroff. Top notes are Iris and Violet; middle notes are Lily-of-the-Valley and Musk; base notes are Raspberry and Sandalwood.",https://www.fragrantica.com/perfume/Caron/Violette-Precieuse-49071.html
"Chouette Vierge No. 4 Chouette Vierge Parfuméefor women and men","for women and men",5,3,"['woody', 'amber', 'warm spicy', 'leather', 'powdery', 'sweet', 'musky', 'chocolate', 'rum', 'vanilla']","['Hoang Nguyen']","Chouette Vierge No. 4byChouette Vierge Parfuméeis a Amber Vanilla fragrance for women and men. This is a new fragrance.Chouette Vierge No. 4was launched in 2024. The nose behind this fragrance is Hoang Nguyen. Top notes are Leather, Ylang-Ylang, Bergamot and Lemon; middle notes are Dark Chocolate, Labdanum, Rum, Patchouli, Bourbon Vanilla, Amber, Coffee, Cypress and Caramel; base notes are Patchouli, Madagascar Vanilla, Vetiver, Musk, Sandalwood and Heliotrope.",https://www.fragrantica.com/perfume/Chouette-Vierge-Parfumee/Chouette-Vierge-No-4-92908.html
"Just Tobacco Ghalatifor women and men","for women and men",5,1,[],"['Chris Maurice']","Just TobaccobyGhalatiis a Amber Woody fragrance for women and men. This is a new fragrance.Just Tobaccowas launched in 2022. The nose behind this fragrance is Chris Maurice. Top notes are Ginger, Tobacco, Cinnamon and Cardamom; middle notes are Vanilla, Cloves, Anise and Cacao; base notes are Amber, Dried Fruits and Sweet Notes.",https://www.fragrantica.com/perfume/Ghalati/Just-Tobacco-79251.html
"Eternal Royal Red Lonkoom Parfumfor men","for men",1,1,"['warm spicy', 'woody', 'fruity', 'rose', 'powdery', 'citrus', 'patchouli', 'musky', 'aromatic', 'sweet']",[],"Eternal Royal RedbyLonkoom Parfumis a Woody Aromatic fragrance for men.Eternal Royal Redwas launched in 2015. Top notes are Litchi, Bergamot and Raspberry; middle notes are Cardamom and Rose; base notes are Musk, Patchouli and Sandalwood.",https://www.fragrantica.com/perfume/Lonkoom-Parfum/Eternal-Royal-Red-71410.html
"Black AXEfor men","for men",3.72,179,"['aquatic', 'ozonic', 'woody', 'warm spicy', 'citrus', 'fruity', 'aromatic', 'sweet', 'floral', 'musky']","['Ann Gottlieb']","BlackbyAXEis a Woody Aromatic fragrance for men.Blackwas launched in 2015. The nose behind this fragrance is Ann Gottlieb. Top notes are Watermelon, Pear, Mandarin Orange and Bergamot; middle notes are Cardamon and Freesia; base notes are Cedar, Musk and Patchouli.",https://www.fragrantica.com/perfume/AXE/Black-29883.html
"Animal Mondain Pierre Guillaume Parisfor women and men","for women and men",3.99,151,"['green', 'sweet', 'tobacco', 'honey', 'woody', 'animalic', 'powdery', 'herbal', 'fresh spicy', 'fruity']","['Pierre Guillaume']","Animal MondainbyPierre Guillaume Parisis a Woody Spicy fragrance for women and men.Animal Mondainwas launched in 2020. The nose behind this fragrance is Pierre Guillaume. Top note is Pear Leaf; middle notes are Tobacco, Honey and Hay; base notes are Mahogany, Powdery Notes and Animal notes.",https://www.fragrantica.com/perfume/Pierre-Guillaume-Paris/Animal-Mondain-63172.html
"Musc Immortel Atelier des Orsfor women and men","for women and men",4,226,"['musky', 'woody', 'earthy', 'aromatic', 'herbal', 'warm spicy', 'sweet', 'powdery', 'iris', 'floral']","['Marie Salamagne']","Musc ImmortelbyAtelier des Orsis a Woody Aromatic fragrance for women and men.Musc Immortelwas launched in 2017. The nose behind this fragrance is Marie Salamagne. Top notes are Iris, Clary Sage and Grapefruit; middle notes are Haitian Vetiver, Cypriol Oil or Nagarmotha and Patchouli; base notes are Immortelle, Ambrette (Musk Mallow) and Musk.",https://www.fragrantica.com/perfume/Atelier-des-Ors/Musc-Immortel-41971.html
"Noorah Bvlgarifor women","for women",4.02,149,"['sweet', 'warm spicy', 'woody', 'tobacco', 'iris', 'vanilla', 'powdery', 'earthy', 'honey', 'amber']","['Daniela (Roche) Andrier']","NoorahbyBvlgariis a Chypre Floral fragrance for women.Noorahwas launched in 2014. The nose behind this fragrance is Daniela (Roche) Andrier.",https://www.fragrantica.com/perfume/Bvlgari/Noorah-27388.html
"Possession Wilgermainfor women and men","for women and men",3.44,39,"['floral', 'fruity', 'rose', 'fresh', 'sweet', 'tropical', 'musky']","['Rodrigo Flores-Roux']","PossessionbyWilgermainis a Floral Woody Musk fragrance for women and men.Possessionwas launched in 2020. The nose behind this fragrance is Rodrigo Flores-Roux. Top notes are Pineapple, Pear Blossom and Cyclamen; middle notes are Amaryllis, Turkish Rose and Orange Blossom; base notes are Musk, Akigalawood and Amber.",https://www.fragrantica.com/perfume/Wilgermain/Possession-63915.html
"Eau My Gosh! Ritualsfor women","for women",3.9,30,"['fruity', 'citrus', 'sweet', 'tropical', 'green', 'aromatic', 'floral', 'white floral', 'terpenic', 'fresh spicy']",[],"Eau My Gosh!byRitualsis a Citrus fragrance for women.Eau My Gosh!was launched in 2020. Top notes are Mango, Orange and Bergamot; middle notes are Rhubarb, Freesia and Jasmine;",https://www.fragrantica.com/perfume/Rituals/Eau-My-Gosh-61333.html
"Gold Immortals Ex Nihilofor women and men","for women and men",4,456,"['amber', 'fresh', 'floral', 'sweet', 'musky', 'fruity', 'yellow floral', 'citrus', 'vanilla', 'white floral']","['Jordi Fernández']","Gold ImmortalsbyEx Nihilois a Amber Floral fragrance for women and men.Gold Immortalswas launched in 2020. The nose behind this fragrance is Jordi Fernández. Top notes are Pear and Bergamot; middle notes are Peony and Lysylang; base notes are Tonka Bean, Musk and Amber.",https://www.fragrantica.com/perfume/Ex-Nihilo/Gold-Immortals-63570.html
"Charlie Breeze Revlonfor women","for women",3.85,13,"['citrus', 'white floral', 'aromatic', 'fresh spicy', 'fresh', 'rose']",[],"Charlie BreezebyRevlonis a Floral Aquatic fragrance for women.Charlie Breezewas launched in 2006. Top notes are Lime, Amalfi Lemon, Melon, Bergamot and Black Currant; middle notes are Jasmine, Rose, Geranium, Lily-of-the-Valley and Red Berries; base notes are Musk and Patchouli.",https://www.fragrantica.com/perfume/Revlon/Charlie-Breeze-14498.html
"Bolzano Mod.5 Parfum Barfor women","for women",5,1,"['white floral', 'fresh', 'rose', 'woody', 'musky', 'amber', 'powdery', 'green', 'fruity', 'floral']",[],"Bolzano Mod.5byParfum Baris a Floral Woody Musk fragrance for women. Top notes are Green Apple and Lily-of-the-Valley; middle notes are Jasmine and White Rose; base notes are Amber, Cedar and Musk.",https://www.fragrantica.com/perfume/Parfum-Bar/Bolzano-Mod-5-25701.html
"Pure Blue Karen Lowfor men","for men",3.89,28,"['citrus', 'aquatic', 'aromatic', 'fresh', 'green', 'fresh spicy']",[],"Pure BluebyKaren Lowis a Citrus Aromatic fragrance for men.",https://www.fragrantica.com/perfume/Karen-Low/Pure-Blue-40216.html
"Amber Special Mahdi Alajmifor women and men","for women and men",,,[],[],"Amber SpecialbyMahdi Alajmiis a Amber fragrance for women and men.",https://www.fragrantica.com/perfume/Mahdi-Alajmi/Amber-Special-59356.html
"White Potion Ayala Morielfor women","for women",4.22,9,"['white floral', 'tuberose', 'yellow floral', 'citrus', 'sweet', 'woody', 'coconut', 'lactonic', 'animalic']","['Ayala Moriel']","White PotionbyAyala Morielis a Floral fragrance for women. The nose behind this fragrance is Ayala Moriel.",https://www.fragrantica.com/perfume/Ayala-Moriel/White-Potion-7946.html
"Ella Forever Hinodefor women","for women",3.36,11,"['tropical', 'fruity', 'sweet', 'marine', 'musky', 'fresh', 'aromatic', 'powdery', 'salty', 'aquatic']",[],"Ella ForeverbyHinodeis a Aromatic Aquatic fragrance for women.",https://www.fragrantica.com/perfume/Hinode/Ella-Forever-47076.html
"Tempête d’Automne Jacques Fathfor women and men","for women and men",3.91,258,"['warm spicy', 'woody', 'aromatic', 'cinnamon', 'sweet', 'citrus', 'lactonic', 'vanilla', 'powdery', 'leather']","['Cécile Zarokian']","Tempête d’AutomnebyJacques Fathis a fragrance for women and men.Tempête d’Automnewas launched in 2018. The nose behind this fragrance is Cécile Zarokian. Top notes are Orange, Mandarin Orange, Pink Pepper and Bergamot; middle notes are Cinnamon, Coriander, Lavender, Ylang-Ylang and White Flowers; base notes are Sandalwood, Milk, Tonka Bean, Leather and Musk.",https://www.fragrantica.com/perfume/Jacques-Fath/Tempete-d-Automne-51568.html
"Café com Creme Thiposfor women and men","for women and men",3.67,27,"['sweet', 'coffee', 'lactonic', 'warm spicy', 'vanilla']",[],"Café com CremebyThiposis a Aromatic fragrance for women and men.Café com Cremewas launched in 2017.",https://www.fragrantica.com/perfume/Thipos/Cafe-com-Creme-64835.html
"Door to the Bay The Dua Brandfor women and men","for women and men",,,"['citrus', 'aromatic', 'woody', 'fresh spicy']",[],"Door to the BaybyThe Dua Brandis a Citrus Aromatic fragrance for women and men.Door to the Baywas launched in 2022.",https://www.fragrantica.com/perfume/The-Dua-Brand/Door-to-the-Bay-86038.html
"La Petite Robe Noire Eau de Parfum Limited Edition 2014 Guerlainfor women","for women",3.57,46,"['sweet', 'fruity', 'vanilla', 'soft spicy', 'almond', 'cherry', 'nutty', 'patchouli', 'rose', 'balsamic']","['Thierry Wasser']","La Petite Robe Noire Eau de Parfum Limited Edition 2014byGuerlainis a Amber Vanilla fragrance for women.La Petite Robe Noire Eau de Parfum Limited Edition 2014was launched in 2014. The nose behind this fragrance is Thierry Wasser. Top notes are Sour Cherry, Red Berries, Almond and Bergamot; middle notes are Licorice, Black Rose, Taif Rose and Black Tea; base notes are Patchouli, Vanilla, Tonka Bean, Iris and Anise.",https://www.fragrantica.com/perfume/Guerlain/La-Petite-Robe-Noire-Eau-de-Parfum-Limited-Edition-2014-28020.html
"Bull's Blood 2nd Edition Imaginary Authorsfor women and men","for women and men",3.42,176,"['rose', 'musky', 'woody', 'tobacco', 'powdery', 'patchouli', 'warm spicy', 'fresh spicy', 'sweet', 'mineral']","['Josh Meyer']","Bull's Blood 2nd EditionbyImaginary Authorsis a Chypre Floral fragrance for women and men. This is a new fragrance.Bull's Blood 2nd Editionwas launched in 2023. The nose behind this fragrance is Josh Meyer.",https://www.fragrantica.com/perfume/Imaginary-Authors/Bull-s-Blood-2nd-Edition-87922.html
"Sams Al Khaleej Sarahs Creationsfor men","for men",3.71,7,[],[],"Sams Al KhaleejbySarahs Creationsis a fragrance for men.",https://www.fragrantica.com/perfume/Sarahs-Creations/Sams-Al-Khaleej-23185.html
"Aire Sutileza Loewefor women","for women",4.26,390,"['white floral', 'fruity', 'citrus', 'fresh', 'floral', 'sweet', 'green', 'musky', 'aquatic', 'powdery']",[],"Aire SutilezabyLoeweis a Floral Woody Musk fragrance for women.Aire Sutilezawas launched in 2017. Top notes are Pear, Calabrian Mandarin and Red Currant; middle notes are Lily-of-the-Valley, Magnolia and Egyptian Jasmine; base notes are Musk, Haitian Vetiver and Sandalwood.",https://www.fragrantica.com/perfume/Loewe/Aire-Sutileza-44895.html
"Cherry De Carmen Alexandria Fragrancesfor women and men","for women and men",5,1,"['amber', 'warm spicy', 'musky', 'balsamic', 'fresh spicy', 'woody']",[],"Cherry De CarmenbyAlexandria Fragrancesis a Amber Floral fragrance for women and men. This is a new fragrance.Cherry De Carmenwas launched in 2023. Top notes are Black Cherry, Pink Pepper and Saffron; middle notes are Cashmere Wood and Rose de Mai; base notes are Frankincense, Myrrh, Amber and Musk.",https://www.fragrantica.com/perfume/Alexandria-Fragrances/Cherry-De-Carmen-92844.html
"1872 Orris Clive Christianfor women","for women",4.06,35,"['citrus', 'iris', 'woody', 'powdery', 'aromatic', 'floral', 'earthy', 'fresh spicy']",[],"1872 OrrisbyClive Christianis a Floral Woody Musk fragrance for women.1872 Orriswas launched in 2017. Top notes are Grapefruit, Bergamot, Mandarin Orange and Petitgrain; middle notes are Iris, Magnolia, Rose, Plum, Jasmine and Cherry Blossom; base notes are Orris, Vetiver, Sandalwood, Amber, Tonka Bean, Musk and Incense.",https://www.fragrantica.com/perfume/Clive-Christian/1872-Orris-46829.html
"Still Life in Rio Olfactive Studiofor women and men","for women and men",4.11,727,"['citrus', 'green', 'fresh spicy', 'coconut', 'warm spicy', 'sweet', 'aromatic']","['Dora Baghriche']","Still Life in RiobyOlfactive Studiois a Aromatic fragrance for women and men.Still Life in Riowas launched in 2016. The nose behind this fragrance is Dora Baghriche. Top notes are Yuzu, Lemon, Ginger, Mandarin Orange and Mint; middle notes are Coconut Milk, Pepper and Black and Pink Pepper; base notes are Rum, Copaiba balm and Leather.",https://www.fragrantica.com/perfume/Olfactive-Studio/Still-Life-in-Rio-35499.html
"Ombre Noire Laliquefor men","for men",4.37,853,"['woody', 'warm spicy', 'amber', 'sweet', 'green', 'tobacco', 'cinnamon', 'aromatic', 'fresh spicy', 'balsamic']","['Karine Dubreuil-Sereni']","Ombre NoirebyLaliqueis a Amber Spicy fragrance for men.Ombre Noirewas launched in 2017. The nose behind this fragrance is Karine Dubreuil-Sereni. Top notes are Fig Leaf, Mint and Bergamot; middle notes are Tobacco Leaf, Cinnamon and Papyrus; base notes are Cognac, Myrhh, Olibanum, Cedar and Tonka Bean.",https://www.fragrantica.com/perfume/Lalique/Ombre-Noire-48063.html
"Anfas Al Oud Al-Rehabfor women and men","for women and men",4.23,22,"['oud', 'fresh spicy', 'warm spicy', 'metallic', 'leather']",[],"Anfas Al OudbyAl-Rehabis a Amber Woody fragrance for women and men.Anfas Al Oudwas launched in 2014.",https://www.fragrantica.com/perfume/Al-Rehab/Anfas-Al-Oud-41487.html
"No 34 Cosy Vanilla Stradivariusfor women","for women",4.17,23,"['vanilla', 'powdery', 'citrus', 'cacao', 'sweet', 'warm spicy', 'fresh spicy', 'aromatic']",[],"No 34 Cosy VanillabyStradivariusis a Floral fragrance for women.No 34 Cosy Vanillawas launched in 2018.",https://www.fragrantica.com/perfume/Stradivarius/No-34-Cosy-Vanilla-82412.html
"Sundus Attar Asgharalifor women","for women",4.11,19,"['woody', 'warm spicy', 'musky', 'amber', 'floral', 'sweet', 'powdery']",[],"Sundus AttarbyAsgharaliis a Amber Vanilla fragrance for women. Top notes are Oriental notes and Floral Notes; middle notes are Sweet Notes and Fruity Notes; base notes are Woody Notes and Musk.",https://www.fragrantica.com/perfume/Asgharali/Sundus-Attar-22605.html
"Sagesse de Salomon Reine de Sabafor women and men","for women and men",4.4,25,"['woody', 'aromatic', 'amber', 'fruity', 'fresh spicy', 'iris', 'lavender', 'citrus', 'powdery', 'sweet']","['Carlos Benaim']","Sagesse de SalomonbyReine de Sabais a Amber Fougere fragrance for women and men. This is a new fragrance.Sagesse de Salomonwas launched in 2022. The nose behind this fragrance is Carlos Benaim. Top notes are Juniper Berries, Mandarin Orange and Red Berries; middle notes are Iris, Lavender and Labdanum; base notes are Amber Xtreme, Cashmeran and Suede.",https://www.fragrantica.com/perfume/Reine-de-Saba/Sagesse-de-Salomon-77462.html
"Golden Shield Poesiefor women and men","for women and men",3.33,3,"['honey', 'citrus', 'sweet', 'floral', 'green']","['Joelle Nealy']","Golden ShieldbyPoesieis a fragrance for women and men.Golden Shieldwas launched in 2018. The nose behind this fragrance is Joelle Nealy.",https://www.fragrantica.com/perfume/Poesie/Golden-Shield-53967.html
"Charlie Black Revlonfor women","for women",3.33,42,"['sweet', 'almond', 'vanilla', 'citrus', 'fruity', 'powdery', 'musky', 'nutty', 'cherry', 'amber']",[],"Charlie BlackbyRevlonis a Amber Vanilla fragrance for women.Charlie Blackwas launched in 2009. Top notes are Mandarin Orange, Cherry and Litchi; middle notes are Almond and Caramel; base notes are Musk, Amber, Coumarin, Vanille and Heliotrope.",https://www.fragrantica.com/perfume/Revlon/Charlie-Black-14480.html
"The Little Mermaid Demeter Fragrancefor women","for women",5,1,"['aquatic', 'marine', 'fresh', 'aromatic', 'floral', 'salty']",[],"The Little MermaidbyDemeter Fragranceis a Floral Aquatic fragrance for women.The Little Mermaidwas launched in 2018.",https://www.fragrantica.com/perfume/Demeter-Fragrance/The-Little-Mermaid-53774.html
"Pink Dream Apple Parfumsfor women","for women",3.38,8,"['white floral', 'fruity', 'woody', 'fresh', 'citrus', 'green', 'rose', 'aromatic', 'floral', 'soft spicy']",[],"Pink DreambyApple Parfumsis a fragrance for women. Top notes are Grapefruit and Cassis; middle notes are Lily-of-the-Valley, Rose and Jasmine; base notes are Woody Notes and Red Apple.",https://www.fragrantica.com/perfume/Apple-Parfums/Pink-Dream-38940.html
"Leather Oud Florisfor women and men","for women and men",4.21,301,"['leather', 'oud', 'fresh spicy', 'woody', 'aromatic', 'warm spicy', 'animalic', 'floral', 'patchouli', 'citrus']",[],"Leather OudbyFlorisis a Amber Woody fragrance for women and men.Leather Oudwas launched in 2014. Top notes are Leather and Bergamot; middle notes are Agarwood (Oud), Geranium, Carnation and Patchouli; base notes are Agarwood (Oud), Woody Notes, Amber and Vetiver.",https://www.fragrantica.com/perfume/Floris/Leather-Oud-25613.html
"Bizarre Brandy Molton Brownfor women and men","for women and men",4.12,60,"['woody', 'warm spicy', 'tobacco', 'sweet', 'coffee', 'cinnamon', 'citrus']","['Karine Dubreuil-Sereni']","Bizarre BrandybyMolton Brownis a Amber Spicy fragrance for women and men.Bizarre Brandywas launched in 2019. The nose behind this fragrance is Karine Dubreuil-Sereni. Top notes are Cinnamon, Orange, Ginger and Cardamom; middle notes are Brandy, Coffee and Maple; base notes are Tobacco, Incense and Cedar.",https://www.fragrantica.com/perfume/Molton-Brown/Bizarre-Brandy-57800.html
"Papavero d'Oriente Nature'sfor women and men","for women and men",3.69,13,"['floral', 'warm spicy', 'woody', 'powdery', 'fruity', 'cinnamon', 'fresh', 'sweet', 'amber', 'citrus']",[],"Papavero d'OrientebyNature'sis a fragrance for women and men.Papavero d'Orientewas launched in 2021. Top notes are Freesia and Mandarin Orange; middle notes are Nectarine, Cherry Blossom and Poppy; base notes are Sandalwood, Cinnamon, Siam Benzoin and Patchouli.",https://www.fragrantica.com/perfume/Nature-s/Papavero-d-Oriente-70763.html
"Figue Sauvage Les Senteurs Gourmandesfor women and men","for women and men",3.66,53,"['woody', 'fruity', 'sweet', 'green', 'floral']",[],"Figue SauvagebyLes Senteurs Gourmandesis a fragrance for women and men.Figue Sauvagewas launched during the 2000's.",https://www.fragrantica.com/perfume/Les-Senteurs-Gourmandes/Figue-Sauvage-43185.html
"Wild Montroifor women and men","for women and men",,,"['woody', 'aromatic', 'fruity', 'sweet', 'green', 'soft spicy', 'balsamic', 'earthy', 'powdery']",[],"WildbyMontroiis a fragrance for women and men. This is a new fragrance.Wildwas launched in 2022.",https://www.fragrantica.com/perfume/Montroi/Wild-80544.html
"Saveur de l’Abricot Artemisia Natural Perfumefor women","for women",5,3,"['fruity', 'floral', 'lactonic', 'powdery', 'soft spicy']",[],"Saveur de l’AbricotbyArtemisia Natural Perfumeis a Floral Fruity fragrance for women.Saveur de l’Abricotwas launched in 2013.",https://www.fragrantica.com/perfume/Artemisia-Natural-Perfume/Saveur-de-l-Abricot-20961.html
"Stallion Soul Ojarfor women and men","for women and men",4.21,14,"['rose', 'woody', 'leather', 'earthy', 'smoky', 'oud', 'amber', 'animalic', 'balsamic', 'warm spicy']","['Michel Girard']","Stallion SoulbyOjaris a Chypre Floral fragrance for women and men.Stallion Soulwas launched in 2021. The nose behind this fragrance is Michel Girard. Top notes are Rose, Incense and Pink Pepper; middle notes are Leather, Violet and Jasmine; base notes are Cypriol Oil or Nagarmotha, Agarwood (Oud), Patchouli, Vanilla and Musk.",https://www.fragrantica.com/perfume/Ojar/Stallion-Soul-65684.html
"Banafsaj Spring Junaid Perfumesfor women","for women",3.6,10,"['fruity', 'sweet', 'white floral']",[],"Banafsaj SpringbyJunaid Perfumesis a Floral Fruity fragrance for women.Banafsaj Springwas launched in 2014. Top note is Fruity Notes; middle note is Jasmine; base note is Musk.",https://www.fragrantica.com/perfume/Junaid-Perfumes/Banafsaj-Spring-26671.html
"Paysandú (Gabriela Hearst) Fueguia 1833for women and men","for women and men",4.06,16,"['floral', 'green', 'woody', 'white floral', 'citrus', 'balsamic', 'aromatic', 'warm spicy']","['Julian Bedel']","Paysandú (Gabriela Hearst)byFueguia 1833is a Floral fragrance for women and men. This is a new fragrance.Paysandú (Gabriela Hearst)was launched in 2023. The nose behind this fragrance is Julian Bedel. Top notes are Herbal Notes and Lemon; middle notes are Floral Notes, Jasmine and Lady of the Night Flower; base notes are Herbal Notes, Copaiba balm, Woody Notes, Cabreuva and Palo Santo.",https://www.fragrantica.com/perfume/Fueguia-1833/Paysandu-Gabriela-Hearst-84573.html
"Damascus Rose Alexandria Fragrancesfor women and men","for women and men",4.21,28,"['woody', 'rose', 'fresh spicy', 'amber', 'aromatic', 'musky', 'floral', 'powdery', 'oud']","['Hany Hafez']","Damascus RosebyAlexandria Fragrancesis a Floral Woody Musk fragrance for women and men.Damascus Rosewas launched in 2017. The nose behind this fragrance is Hany Hafez. Top notes are Rose and Caraway; middle notes are Rose, Vetiver and Cedar; base notes are Musk, Olibanum, Labdanum, Guaiac Wood and Agarwood (Oud).",https://www.fragrantica.com/perfume/Alexandria-Fragrances/Damascus-Rose-47709.html
"Love U/Kill U Acidica Perfumesfor women and men","for women and men",4.2,5,"['citrus', 'amber', 'vanilla', 'powdery', 'musky', 'sweet', 'warm spicy', 'fresh']","['Elena Markova']","Love U/Kill UbyAcidica Perfumesis a fragrance for women and men. This is a new fragrance.Love U/Kill Uwas launched in 2023. The nose behind this fragrance is Elena Markova.",https://www.fragrantica.com/perfume/Acidica-Perfumes/Love-U-Kill-U-91759.html
"Made to Measure Guccifor men","for men",3.47,"1,066","['fresh spicy', 'aromatic', 'lavender', 'fruity', 'citrus', 'sweet', 'amber', 'woody', 'floral', 'leather']",[],"Made to MeasurebyGucciis a Amber Spicy fragrance for men.Made to Measurewas launched in 2013. Top notes are Lavender, Calabrian bergamot, Tunisian Orange Blossom and Anise; middle notes are Plum, Juniper Berries, Cinnamon, Nutmeg and Water Lily; base notes are Leather, Amber, Patchouli and Labdanum.",https://www.fragrantica.com/perfume/Gucci/Made-to-Measure-18703.html
"Creative Visionary H&Mfor women","for women",3.81,21,"['fruity', 'white floral', 'vanilla', 'tropical', 'fresh', 'sweet']",[],"Creative VisionarybyH&Mis a Floral Fruity fragrance for women. This is a new fragrance.Creative Visionarywas launched in 2024. Top notes are Coconut Water and Guava; middle notes are Tiare Flower, White Blossom and Violet; base notes are Vanilla, Patchouli and Musk.",https://www.fragrantica.com/perfume/H-M/Creative-Visionary-92538.html
