Name,Gender,"Rating Value","Rating Count","Main Accords",Perfumers,Description,url
"Sweet Coffee Anthologyfor women","for women",,,"['coffee', 'vanilla', 'white floral', 'warm spicy', 'citrus', 'sweet', 'powdery', 'soapy']",[],"Sweet CoffeebyAnthologyis a fragrance for women. This is a new fragrance.Sweet Coffeewas launched in 2023. Top note is Coffee; middle note is Orange Blossom; base note is Vanilla.",https://www.fragrantica.com/perfume/Anthology/Sweet-Coffee-88530.html
"MMIX - 2009 L'Eau De Cassisfor women and men","for women and men",,,"['woody', 'earthy', 'musky', 'aromatic', 'fresh spicy', 'mossy', 'warm spicy', 'soft spicy', 'powdery']",[],"MMIX - 2009byL'Eau De Cassisis a Woody Chypre fragrance for women and men.",https://www.fragrantica.com/perfume/L-Eau-De-Cassis/MMIX-2009-65339.html
"Patchouli Creme Esscentual Alchemyfor women and men","for women and men",5,3,"['floral', 'yellow floral', 'powdery', 'musky', 'fresh spicy', 'sweet', 'lavender', 'vanilla', 'amber']","['Amanda Feeley']","Patchouli CremebyEsscentual Alchemyis a Amber fragrance for women and men.Patchouli Cremewas launched during the 2010's. The nose behind this fragrance is Amanda Feeley.",https://www.fragrantica.com/perfume/Esscentual-Alchemy/Patchouli-Creme-26860.html
"Caupé Chamma da Amazôniafor women","for women",5,1,"['woody', 'floral', 'fresh', 'green', 'oily', 'powdery', 'warm spicy', 'herbal']","['Oscar Chamma']","CaupébyChamma da Amazôniais a Floral fragrance for women.Caupéwas launched in 2015. The nose behind this fragrance is Oscar Chamma.",https://www.fragrantica.com/perfume/Chamma-da-Amazonia/Caupe-61818.html
"Ved’Ma Sixteen92for women and men","for women and men",4.08,26,"['earthy', 'amber', 'smoky', 'balsamic', 'green', 'warm spicy']","['Claire Baxter']","Ved’MabySixteen92is a Woody Aromatic fragrance for women and men.Ved’Mawas launched in 2015. The nose behind this fragrance is Claire Baxter.",https://www.fragrantica.com/perfume/Sixteen92/Ved-Ma-58245.html
"Mystic Aromatic Muglerfor women and men","for women and men",4.01,231,"['aromatic', 'fresh spicy', 'herbal', 'balsamic', 'amber', 'green']","['Jean-Christophe Hérault']","Mystic AromaticbyMugleris a Aromatic fragrance for women and men.Mystic Aromaticwas launched in 2018. The nose behind this fragrance is Jean-Christophe Hérault.",https://www.fragrantica.com/perfume/Mugler/Mystic-Aromatic-49025.html
"Kogaï For Her Annayakefor women","for women",4.44,16,"['floral', 'powdery', 'woody', 'white floral', 'iris', 'vanilla', 'soft spicy', 'citrus', 'violet', 'earthy']",[],"Kogaï For HerbyAnnayakeis a fragrance for women. This is a new fragrance.Kogaï For Herwas launched in 2022. Top notes are Water Jasmine, Pink Pepper and Mandarin Orange; middle notes are Iris, Freesia and Peony; base notes are Vanilla, Sandalwood and Cedar.",https://www.fragrantica.com/perfume/Annayake/Kogai-For-Her-76117.html
"Dahlia Noir Givenchyfor women","for women",3.68,"2,625","['powdery', 'woody', 'iris', 'rose', 'earthy', 'vanilla', 'sweet', 'patchouli', 'warm spicy', 'floral']","['François Demachy']","Dahlia NoirbyGivenchyis a Chypre Floral fragrance for women.Dahlia Noirwas launched in 2011. The nose behind this fragrance is François Demachy. Top notes are Pink Pepper, Mimosa, Mandarin Orange and Bergamot; middle notes are Iris, Rose and Patchouli; base notes are Sandalwood, Tonka Bean, Vanille and Oakmoss.",https://www.fragrantica.com/perfume/Givenchy/Dahlia-Noir-12146.html
"Virginia Tech Women Masik Collegiate Fragrancesfor women","for women",,,"['citrus', 'white floral', 'woody', 'aromatic', 'amber', 'sweet', 'green', 'fresh', 'aquatic', 'marine']",[],"Virginia Tech WomenbyMasik Collegiate Fragrancesis a Floral Green fragrance for women. Top notes are Sea Notes, Orange, Lime and Apple; middle notes are Tamarind, Jasmine, Marigold, Lily-of-the-Valley and Violet Leaf; base notes are Palisander Rosewood, Woody Notes, Amber and White Musk.",https://www.fragrantica.com/perfume/Masik-Collegiate-Fragrances/Virginia-Tech-Women-21207.html
"White Flowers & Amber H&Mfor women","for women",3.5,4,"['white floral', 'amber', 'woody', 'powdery', 'animalic', 'warm spicy']",[],"White Flowers & AmberbyH&Mis a Floral fragrance for women.White Flowers & Amberwas launched in 2014.",https://www.fragrantica.com/perfume/H-M/White-Flowers-Amber-34599.html
"Tahiti Abdul Karim Al Faransifor women and men","for women and men",4.12,16,"['powdery', 'coconut', 'vanilla', 'woody', 'oud', 'sweet', 'musky', 'lactonic', 'warm spicy', 'tropical']","['Anthony Abdul Karim Marmin']","TahitibyAbdul Karim Al Faransiis a Amber fragrance for women and men.Tahitiwas launched in 2014. The nose behind this fragrance is Anthony Abdul Karim Marmin. Top notes are Tahitian Vanilla and Cotton Flower; middle notes are Coconut and White Musk; base notes are White Oud and Sandalwood.",https://www.fragrantica.com/perfume/Abdul-Karim-Al-Faransi/Tahiti-36983.html
"Sham'n Fashion Arno Sorelfor women","for women",3.44,9,"['citrus', 'woody', 'warm spicy', 'patchouli', 'fruity', 'amber', 'powdery', 'sweet', 'balsamic', 'white floral']",[],"Sham'n FashionbyArno Sorelis a Floral Fruity fragrance for women. Top notes are Orange, Lemon and Mandarin Orange; middle notes are Peach, Plum, Rose, Jasmine, Violet and Lily-of-the-Valley; base notes are Patchouli, Sandalwood, Benzoin, Amber, Vanilla, Oakmoss and Musk.",https://www.fragrantica.com/perfume/Arno-Sorel/Sham-n-Fashion-9058.html
"Helioflora Pierre Guillaume Parisfor women and men","for women and men",3.97,155,"['fruity', 'green', 'aromatic', 'fresh spicy', 'floral', 'powdery', 'woody', 'sweet', 'lactonic', 'herbal']","['Pierre Guillaume']","HelioflorabyPierre Guillaume Parisis a Woody Floral Musk fragrance for women and men.Helioflorawas launched in 2019. The nose behind this fragrance is Pierre Guillaume. Top notes are Apricot, Rhubarb and Basil; middle note is Buddleia; base note is Red Sandalwood.",https://www.fragrantica.com/perfume/Pierre-Guillaume-Paris/Helioflora-54825.html
"The Path Tonatto Profumifor women and men","for women and men",2,2,"['oud', 'fresh spicy']",[],"The PathbyTonatto Profumiis a Woody Aromatic fragrance for women and men.",https://www.fragrantica.com/perfume/Tonatto-Profumi/The-Path-32185.html
"01 Magic Onsen Zarafor women","for women",3.38,40,"['musky', 'white floral', 'woody', 'powdery', 'amber', 'animalic', 'citrus', 'sweet']",[],"01 Magic OnsenbyZarais a Floral Woody Musk fragrance for women.01 Magic Onsenwas launched in 2017.",https://www.fragrantica.com/perfume/Zara/01-Magic-Onsen-43457.html
"Eau de Shalimar Edition Charms Guerlainfor women","for women",4.56,79,"['citrus', 'vanilla', 'powdery', 'iris', 'rose', 'fresh spicy', 'sweet', 'floral']",[],"Eau de Shalimar Edition CharmsbyGuerlainis a Floral Fruity fragrance for women.Eau de Shalimar Edition Charmswas launched in 2010. Top notes are Lime, Bergamot and Orange; middle notes are Vanilla, Rose and Jasmine; base notes are Vanilla and Iris.",https://www.fragrantica.com/perfume/Guerlain/Eau-de-Shalimar-Edition-Charms-25332.html
"Miss Julie Arno Sorelfor women","for women",4.33,3,"['woody', 'fresh', 'floral', 'aquatic', 'fruity', 'powdery', 'warm spicy', 'citrus', 'vanilla', 'green']",[],"Miss JuliebyArno Sorelis a Floral Aquatic fragrance for women. Top notes are Apple, Lemon and Water Notes; middle notes are Freesia, Water Lily and Vanilla; base notes are Sandalwood, Cedar, Spicy Notes and Musk.",https://www.fragrantica.com/perfume/Arno-Sorel/Miss-Julie-27525.html
"Pure Grace Summer Surf Philosophyfor women","for women",4.09,53,"['marine', 'musky', 'white floral', 'aromatic', 'woody', 'powdery', 'salty', 'aquatic', 'sweet', 'fruity']",[],"Pure Grace Summer SurfbyPhilosophyis a Floral Woody Musk fragrance for women.Pure Grace Summer Surfwas launched in 2017. Top note is Tiare Flower; middle note is Sea Notes; base notes are Musk and Woodsy Notes.",https://www.fragrantica.com/perfume/Philosophy/Pure-Grace-Summer-Surf-43764.html
"Glamour Infinit O Boticáriofor women","for women",3.25,4,"['fruity', 'floral', 'sweet', 'powdery', 'fresh spicy', 'iris', 'musky']",[],"Glamour InfinitbyO Boticáriois a Floral fragrance for women.Glamour Infinitwas launched in 2011. Top notes are Plum, Bergamot Blossom, Pepper and Flowers; middle notes are Iris, Lotus and Osmanthus; base notes are Tonka Bean, Musk and Sandalwood.",https://www.fragrantica.com/perfume/O-Boticario/Glamour-Infinit-75530.html
"Fuel for Life Homme Dieselfor men","for men",3.91,"3,104","['fruity', 'sweet', 'anis', 'lavender', 'soft spicy', 'citrus', 'woody', 'aromatic', 'fresh spicy', 'floral']","['Annick Menardo', 'Jacques Cavallier']","Fuel for Life HommebyDieselis a Aromatic Fougere fragrance for men.Fuel for Life Hommewas launched in 2007. Fuel for Life Homme was created by Annick Menardo and Jacques Cavallier. Top notes are Anise and Grapefruit; middle notes are Raspberry and Lavender; base notes are Woodsy Notes and Heliotrope.",https://www.fragrantica.com/perfume/Diesel/Fuel-for-Life-Homme-1605.html
"Varens For Men Tabac Coton Ulric de Varensfor men","for men",4.44,18,"['sweet', 'tobacco', 'woody', 'vanilla', 'musky', 'amber', 'powdery', 'fruity', 'aromatic', 'rum']",[],"Varens For Men Tabac CotonbyUlric de Varensis a fragrance for men. This is a new fragrance.Varens For Men Tabac Cotonwas launched in 2023. Top notes are Rum and Bergamot; middle notes are Tobacco and Cedar; base notes are Tonka, Musk and Dates.",https://www.fragrantica.com/perfume/Ulric-de-Varens/Varens-For-Men-Tabac-Coton-88504.html
"Stellar Dreamers Ex Nihilofor women and men","for women and men",4.46,13,"['fruity', 'sweet', 'leather', 'oud', 'animalic', 'amber', 'tuberose', 'white floral', 'vanilla', 'warm spicy']","['Jordi Fernández']","Stellar DreamersbyEx Nihilois a Leather fragrance for women and men. The nose behind this fragrance is Jordi Fernández. Top notes are Saffron and Pink Pepper; middle notes are Plum, Tuberose and Rose; base notes are Agarwood (Oud), Leather, Amber and Vanilla.",https://www.fragrantica.com/perfume/Ex-Nihilo/Stellar-Dreamers-72931.html
"Ambre Lumiere Voluspafor women and men","for women and men",4.38,8,"['amber', 'warm spicy', 'patchouli', 'balsamic', 'vanilla']",[],"Ambre LumierebyVoluspais a Amber fragrance for women and men.Ambre Lumierewas launched in 2010. Top note is Light Amber; middle note is Vanilla; base notes are Benzoin and Indonesian Patchouli Leaf.",https://www.fragrantica.com/perfume/Voluspa/Ambre-Lumiere-26348.html
"Mempasa Al-Rehabfor women and men","for women and men",3.67,3,"['almond', 'nutty', 'fruity', 'sweet']",[],"MempasabyAl-Rehabis a Amber fragrance for women and men.Mempasawas launched in 2016.",https://www.fragrantica.com/perfume/Al-Rehab/Mempasa-58743.html
"Peperoncino Dr. Taffifor women","for women",3.5,8,"['warm spicy']",[],"PeperoncinobyDr. Taffiis a Aromatic Spicy fragrance for women.",https://www.fragrantica.com/perfume/Dr-Taffi/Peperoncino-16834.html
"Sexy Blossom Michael Korsfor women","for women",3.71,194,"['floral', 'fresh', 'rose', 'green', 'aquatic', 'white floral', 'fruity', 'musky', 'tropical', 'powdery']",[],"Sexy BlossombyMichael Korsis a Floral Woody Musk fragrance for women.Sexy Blossomwas launched in 2016. Top notes are Litchi, Green Leaves, Dew Drop and Rose Petals; middle notes are Peony, Lily-of-the-Valley, Freesia and Orchid; base notes are Musk, Ambroxan and Sandalwood.",https://www.fragrantica.com/perfume/Michael-Kors/Sexy-Blossom-40924.html
"Egeo Cherry Blast O Boticáriofor women","for women",3.86,413,"['sweet', 'fruity', 'cherry', 'caramel', 'vanilla']","['Emilie Bevierre-Coppermann', 'Leslie Gauthier']","Egeo Cherry BlastbyO Boticáriois a Amber Floral fragrance for women. This is a new fragrance.Egeo Cherry Blastwas launched in 2022. Egeo Cherry Blast was created by Emilie Bevierre-Coppermann and Leslie Gauthier. Top notes are Cherry, Syrup, Raspberry, Blackberry, Cassis, Pineapple, Nashi Pear, Bergamot and Cupuacu, Cupuassu, Copoasu; middle notes are Tiramisu, Almond, Rose, Tuberose, Violet, Ylang-Ylang and Curry; base notes are Caramel, Vanilla, Sandalwood, Musk and Cedar.",https://www.fragrantica.com/perfume/O-Boticario/Egeo-Cherry-Blast-71735.html
"Pucker Up Haught Parfumsfor women and men","for women and men",3,2,"['sweet', 'citrus', 'coconut', 'lactonic', 'vanilla']","['Jarekhye Covarrubias']","Pucker UpbyHaught Parfumsis a Amber Vanilla fragrance for women and men.Pucker Upwas launched in 2015. The nose behind this fragrance is Jarekhye Covarrubias. Top notes are Butter, Lemon Zest and Lemon; middle notes are Biscuit, Coconut, Limoncello, Lemon Verbena and Green Notes; base notes are Sugar, White Chocolate and White Musk.",https://www.fragrantica.com/perfume/Haught-Parfums/Pucker-Up-36057.html
"Kismet Essenzialmente Laurafor women and men","for women and men",4.33,3,"['amber', 'balsamic', 'warm spicy', 'sweet', 'vanilla', 'aromatic']","['Laura Bosetti Tonatto']","KismetbyEssenzialmente Laurais a Amber Vanilla fragrance for women and men. The nose behind this fragrance is Laura Bosetti Tonatto.",https://www.fragrantica.com/perfume/Essenzialmente-Laura/Kismet-42517.html
"Açaí O Boticáriofor women","for women",4.18,39,"['fruity', 'sweet', 'vanilla']",[],"AçaíbyO Boticáriois a Floral Fruity fragrance for women.Açaíwas launched in 2018. Top notes are Plum, Acai Berry, Apple, Cherry and Green Notes; middle notes are Freesia, Raspberry, Almond and Yogurt; base notes are Vanilla, Sweet Notes, Heliotrope, Oily Notes and Sandalowood.",https://www.fragrantica.com/perfume/O-Boticario/Acai-56345.html
"Mukhallat Dahn Al Oudh Moattaq Ajmalfor women and men","for women and men",4.6,67,"['animalic', 'rose', 'woody', 'musky', 'powdery', 'oud', 'warm spicy', 'floral']",[],"Mukhallat Dahn Al Oudh MoattaqbyAjmalis a Woody Floral Musk fragrance for women and men.Mukhallat Dahn Al Oudh Moattaqwas launched in 2017. Top notes are Turkish Rose, Indian Oud, Woodsy Notes and Exotic Spices; middle notes are Cambodian Oud and Amber; base notes are Rose, Animal notes, Musk and Powdery Notes.",https://www.fragrantica.com/perfume/Ajmal/Mukhallat-Dahn-Al-Oudh-Moattaq-51253.html
"CiocoSpesizissimo Hilde Solianifor women and men","for women and men",3.68,47,"['chocolate', 'warm spicy', 'fresh spicy', 'sweet', 'aromatic', 'green', 'cacao', 'woody']","['Hilde Soliani']","CiocoSpesizissimobyHilde Solianiis a Aromatic Spicy fragrance for women and men. The nose behind this fragrance is Hilde Soliani.",https://www.fragrantica.com/perfume/Hilde-Soliani/CiocoSpesizissimo-10242.html
"Sheer Beauty Essence Calvin Kleinfor women","for women",3.68,616,"['floral', 'fresh', 'rose', 'fruity', 'musky']",[],"Sheer Beauty EssencebyCalvin Kleinis a Floral fragrance for women.Sheer Beauty Essencewas launched in 2013. Top notes are Pear Blossom and White Peach; middle notes are Lilac, Turkish Rose, Peony and Magnolia; base notes are Musk, Vanilla and Cedar.",https://www.fragrantica.com/perfume/Calvin-Klein/Sheer-Beauty-Essence-18124.html
"Whisky Nobile Farmacia SS. Annunziatafor women and men","for women and men",4.33,85,"['warm spicy', 'whiskey', 'cacao', 'woody', 'coffee', 'vanilla', 'amber', 'smoky', 'leather']",[],"Whisky NobilebyFarmacia SS. Annunziatais a Woody fragrance for women and men.Whisky Nobilewas launched in 2021. Top notes are Coffee, Incense and Orange Blossom; middle notes are Whiskey, Cacao and Styrax; base notes are Vanilla, Leather, Agarwood (Oud), Saffron and Vetiver.",https://www.fragrantica.com/perfume/Farmacia-SS-Annunziata/Whisky-Nobile-71600.html
"MIrra for Men Mirrafor men","for men",5,1,"['aromatic', 'woody', 'fresh spicy', 'citrus', 'musky', 'patchouli', 'powdery', 'green', 'warm spicy', 'earthy']",[],"MIrra for MenbyMirrais a Citrus Aromatic fragrance for men.",https://www.fragrantica.com/perfume/Mirra/MIrra-for-Men-33902.html
"Vodka Extreme Paris Elyseesfor men","for men",3.89,95,"['woody', 'aromatic', 'musky', 'fresh spicy', 'patchouli', 'herbal', 'conifer', 'warm spicy', 'balsamic', 'powdery']",[],"Vodka ExtremebyParis Elyseesis a Aromatic fragrance for men.Vodka Extremewas launched in 2001. Top notes are Artemisia and Rosemary; middle notes are Pine and Geranium; base notes are Musk and Patchouli.",https://www.fragrantica.com/perfume/Paris-Elysees/Vodka-Extreme-35279.html
"Signature Lovers For Man Replayfor men","for men",4.12,26,"['fruity', 'aromatic', 'warm spicy', 'woody', 'lavender', 'sweet', 'amber', 'citrus', 'fresh spicy', 'violet']",[],"Signature Lovers For ManbyReplayis a Woody Aromatic fragrance for men.Signature Lovers For Manwas launched in 2020. Top notes are Plum, Mandarin Orange and Pomelo; middle notes are Cardamom, Lavender and Violet; base notes are Labdanum, Guaiac Wood and Bourbon Vetiver.",https://www.fragrantica.com/perfume/Replay/Signature-Lovers-For-Man-60321.html
"Musk Kashmir Attar Collectionfor women and men","for women and men",3.66,"1,706","['musky', 'powdery', 'warm spicy', 'fresh spicy', 'woody', 'white floral', 'animalic']",[],"Musk KashmirbyAttar Collectionis a Floral Woody Musk fragrance for women and men.Musk Kashmirwas launched in 2016.",https://www.fragrantica.com/perfume/Attar-Collection/Musk-Kashmir-38134.html
"Dreamer The Original Edition Versacefor men","for men",4.08,"5,140","['aromatic', 'lavender', 'tobacco', 'sweet', 'fresh spicy', 'woody', 'herbal', 'rose', 'vanilla', 'floral']","['Jean-Pierre Bethouart']","Dreamer The Original EditionbyVersaceis a Amber Fougere fragrance for men.Dreamer The Original Editionwas launched in 1996. The nose behind this fragrance is Jean-Pierre Bethouart. Top notes are Lavender, Sage and Mandarin Orange; middle notes are Tobacco, Rose, Carnation and Geranium; base notes are Tonka Bean, Fir, Vetiver and Cedar.",https://www.fragrantica.com/perfume/Versace/Dreamer-The-Original-Edition-642.html
"Rhum & Tabac Comptoir Sud Pacifiquefor women and men","for women and men",4,367,"['warm spicy', 'tobacco', 'rum', 'cinnamon', 'woody', 'sweet', 'patchouli', 'citrus', 'aromatic']","['Thomas Fontaine']","Rhum & TabacbyComptoir Sud Pacifiqueis a fragrance for women and men.Rhum & Tabacwas launched in 2016. The nose behind this fragrance is Thomas Fontaine. Top note is Lime; middle notes are Rum, Cinnamon and Cardamom; base notes are Tobacco Leaf and Indonesian Patchouli Leaf.",https://www.fragrantica.com/perfume/Comptoir-Sud-Pacifique/Rhum-Tabac-37438.html
"Private Show Britney Spearsfor women","for women",4.07,"1,931","['sweet', 'lactonic', 'coffee', 'vanilla']","['Caroline Sabas']","Private ShowbyBritney Spearsis a Floral Fruity Gourmand fragrance for women.Private Showwas launched in 2016. The nose behind this fragrance is Caroline Sabas. Top notes are Whipped Cream, Coffee, Nectarine and Clementine; middle notes are Dulce de leche, Jasmine Sambac and Orange Blossom; base notes are Amber and Musk.",https://www.fragrantica.com/perfume/Britney-Spears/Private-Show-39382.html
"Surreal Ocean Avonfor women","for women",3.95,207,"['fruity', 'marine', 'citrus', 'white floral', 'woody', 'sweet', 'amber', 'fresh', 'lactonic', 'animalic']","['Honorine Blanc']","Surreal OceanbyAvonis a Floral Fruity fragrance for women.Surreal Oceanwas launched in 2014. The nose behind this fragrance is Honorine Blanc. Top notes are Coral Reef, Mandarin Orange and Soursop; middle notes are Red Apple, Gardenia and Water Lily; base notes are Cedar, Amber and Pearls.",https://www.fragrantica.com/perfume/Avon/Surreal-Ocean-33912.html
"Oro Nero Bois 1920for women and men","for women and men",4.06,114,"['warm spicy', 'woody', 'leather', 'citrus', 'vanilla', 'powdery', 'animalic', 'patchouli', 'amber', 'sweet']",[],"Oro NerobyBois 1920is a Amber Woody fragrance for women and men.Oro Nerowas launched in 2017. Top notes are Saffron, Cloves, Orange and Bergamot; middle notes are Patchouli, Sandalwood, Cedar and Ylang-Ylang; base notes are Leather, Vanilla and Amber.",https://www.fragrantica.com/perfume/Bois-1920/Oro-Nero-44297.html
"Rose Supercritique Les EAUX Primordialesfor women and men","for women and men",3.92,119,"['rose', 'vanilla', 'sweet', 'powdery', 'violet', 'aromatic', 'citrus', 'floral', 'soft spicy', 'green']","['Arnaud Poulain']","Rose SupercritiquebyLes EAUX Primordialesis a Floral fragrance for women and men.Rose Supercritiquewas launched in 2018. The nose behind this fragrance is Arnaud Poulain. Top notes are Pink Pepper and Lemon; middle notes are Rose, Green Notes, Raspberry and Geranium; base notes are Vanilla, Violet and Coumarin.",https://www.fragrantica.com/perfume/Les-EAUX-Primordiales/Rose-Supercritique-49556.html
"Qaa'ed Intense Lattafa Perfumesfor men","for men",4.49,154,"['amber', 'vanilla', 'sweet', 'warm spicy', 'cacao', 'tobacco', 'honey', 'powdery', 'balsamic', 'cinnamon']",[],"Qaa'ed IntensebyLattafa Perfumesis a Amber Spicy fragrance for men. This is a new fragrance.Qaa'ed Intensewas launched in 2024. Top notes are Tobacco, White Honey and Cinammon; middle notes are Vanilla, Cacao, Patchouli and Myrrh; base notes are Amber, Styrax and French labdanum.",https://www.fragrantica.com/perfume/Lattafa-Perfumes/Qaa-ed-Intense-90438.html
"Ambre Gris Alyssa Ashleyfor women","for women",3.93,177,"['amber', 'woody', 'rose', 'powdery', 'vanilla', 'soft spicy', 'musky', 'citrus', 'balsamic']","['Luca Maffei']","Ambre GrisbyAlyssa Ashleyis a Amber Floral fragrance for women.Ambre Griswas launched in 2012. The nose behind this fragrance is Luca Maffei. Top notes are Pink Pepper, Calabrian bergamot and Sicilian Lemon; middle notes are Bulgarian Rose and Indian Jasmine; base notes are Amber, Labdanum, Sandalwood and Madagascar Vanilla.",https://www.fragrantica.com/perfume/Alyssa-Ashley/Ambre-Gris-15691.html
"Oud Gadir Darkbeat Parfumsfor women and men","for women and men",4.21,14,"['amber', 'sweet', 'oud', 'fruity', 'woody', 'tobacco', 'vanilla', 'powdery', 'citrus', 'balsamic']","['José M. Giraldo']","Oud GadirbyDarkbeat Parfumsis a fragrance for women and men.Oud Gadirwas launched in 2021. The nose behind this fragrance is José M. Giraldo. Top notes are Raspberry and Mandarin Orange; middle notes are Tobacco and Jasmine; base notes are Labdanum, Agarwood (Oud), Amber, Vanilla and Sandalwood.",https://www.fragrantica.com/perfume/Darkbeat-Parfums/Oud-Gadir-64971.html
"Whispers of Innocence House Of Sillagefor women","for women",3.42,71,"['yellow floral', 'honey', 'beeswax', 'sweet', 'white floral', 'amber', 'vanilla', 'animalic', 'powdery', 'floral']",[],"Whispers of InnocencebyHouse Of Sillageis a Floral Fruity Gourmand fragrance for women.Whispers of Innocencewas launched in 2017. Top notes are Lime (Linden) Blossom and Violet Leaf; middle notes are Beeswax and Egyptian Jasmine; base notes are Amber and Vanilla.",https://www.fragrantica.com/perfume/House-Of-Sillage/Whispers-of-Innocence-47313.html
"Floratta in Lilac O Boticáriofor women","for women",3.79,34,"['floral', 'fruity', 'soft spicy', 'citrus', 'musky', 'woody', 'powdery', 'fresh', 'sweet', 'white floral']","['Thierry Bessard']","Floratta in LilacbyO Boticáriois a Floral fragrance for women.Floratta in Lilacwas launched in 2009. The nose behind this fragrance is Thierry Bessard. Top notes are Black Currant and Citruses; middle notes are Freesia, Pink Pepper, Orchid and Jasmine; base notes are Musk, Sandalwood and Amber.",https://www.fragrantica.com/perfume/O-Boticario/Floratta-in-Lilac-9771.html
"Thank U Next 2.0 Ariana Grandefor women","for women",4.15,776,"['fruity', 'sweet', 'woody', 'powdery', 'musky']",[],"Thank U Next 2.0byAriana Grandeis a Floral Fruity fragrance for women.Thank U Next 2.0was launched in 2021. Top notes are Apple juice, Wild Strawberry and Pomegranate; middle notes are White Orchid and Jasmine; base notes are Marshmallow, Musk and Sandalwood.",https://www.fragrantica.com/perfume/Ariana-Grande/Thank-U-Next-2-0-68367.html
"Mouse King Latheratifor women and men","for women and men",4,2,"['aldehydic', 'citrus', 'fresh', 'amber', 'musky', 'mossy', 'earthy', 'tuberose', 'powdery', 'soapy']","['Julie Grogan']","Mouse KingbyLatheratiis a Chypre Fruity fragrance for women and men.Mouse Kingwas launched in 2018. The nose behind this fragrance is Julie Grogan.",https://www.fragrantica.com/perfume/Latherati/Mouse-King-52746.html
"Sweet Sticky Things Haught Parfumsfor women and men","for women and men",3.9,29,"['sweet', 'caramel', 'marine', 'aromatic', 'powdery']","['Jarekhye Covarrubias']","Sweet Sticky ThingsbyHaught Parfumsis a fragrance for women and men.Sweet Sticky Thingswas launched in 2016. The nose behind this fragrance is Jarekhye Covarrubias.",https://www.fragrantica.com/perfume/Haught-Parfums/Sweet-Sticky-Things-39692.html
"Luan Santana LS&You Live Jequitifor men","for men",4.08,13,"['amber', 'aromatic', 'fresh spicy', 'marine', 'animalic', 'white floral', 'sweet', 'salty', 'warm spicy', 'balsamic']",[],"Luan Santana LS&You LivebyJequitiis a Woody fragrance for men.Luan Santana LS&You Livewas launched in 2019. Top notes are Bay Leaf, Plum and Black Pepper; middle notes are Sea Notes, Orange Blossom, Geranium and Cashmirwood; base notes are Ambergris, Benzoin, Leather, Cedar and Tonka Bean.",https://www.fragrantica.com/perfume/Jequiti/Luan-Santana-LS-You-Live-56738.html
"The Ritual of Chadō Ritualsfor women and men","for women and men",4.12,34,"['woody', 'green', 'fresh', 'ozonic', 'earthy']",[],"The Ritual of ChadōbyRitualsis a Aromatic Green fragrance for women and men.The Ritual of Chadōwas launched in 2019.",https://www.fragrantica.com/perfume/Rituals/The-Ritual-of-Chado-54804.html
"Energique CIEL Parfumfor women","for women",5,2,"['citrus', 'aromatic', 'woody', 'green', 'fresh spicy', 'fresh', 'white floral']",[],"EnergiquebyCIEL Parfumis a Citrus fragrance for women. Top notes are Petitgrain, Citruses and Mandarin Orange; middle notes are Neroli and Lavender; base notes are Cedar and Musk.",https://www.fragrantica.com/perfume/CIEL-Parfum/Energique-34449.html
