Name,Gender,"Rating Value","Rating Count","Main Accords",Perfumers,Description,url
"102 Mandarino LabSoluefor women and men","for women and men",,,"['citrus', 'vanilla', 'sweet', 'fruity', 'powdery']","['Alex Lee']","102 MandarinobyLabSolueis a Amber Vanilla fragrance for women and men. The nose behind this fragrance is Alex Lee.",https://www.fragrantica.com/perfume/LabSolue/102-Mandarino-94274.html
"Sabah Al Ward Al Wataniahfor women","for women",4.25,199,"['vanilla', 'white floral', 'sweet', 'warm spicy', 'cacao', 'citrus', 'soft spicy', 'amber', 'patchouli', 'balsamic']",[],"Sabah Al WardbyAl Wataniahis a Amber Floral fragrance for women. Top notes are Pink Pepper and Mandarin Orange; middle notes are Cacao Pod, Orange Blossom and Jasmine Sambac; base notes are Vanilla, Tonka Bean and Patchouli.",https://www.fragrantica.com/perfume/Al-Wataniah/Sabah-Al-Ward-64579.html
"Arabian Prestige Classic Arabian Oudfor women and men","for women and men",4.33,21,"['woody', 'vanilla', 'powdery', 'warm spicy', 'patchouli', 'balsamic', 'earthy', 'aromatic']",[],"Arabian Prestige ClassicbyArabian Oudis a Amber Woody fragrance for women and men. Top note is Vanilla; middle note is Sandalwood; base notes are Patchouli and Vetiver.",https://www.fragrantica.com/perfume/Arabian-Oud/Arabian-Prestige-Classic-21602.html
"Via Condotti Pour Femme Lancettifor women","for women",4.39,41,"['powdery', 'floral', 'woody', 'fresh', 'white floral', 'amber', 'aldehydic', 'vanilla', 'fruity', 'anis']",[],"Via Condotti Pour FemmebyLancettiis a Floral Aldehyde fragrance for women.Via Condotti Pour Femmewas launched in 1985. Top notes are Aldehydes, Anise, Fruity Notes, Mandarin Orange and Green Notes; middle notes are Cyclamen, Jasmine, Heliotrope, Rose, Lily-of-the-Valley and Orris Root; base notes are Sandalwood, Vetiver, Amber, Benzoin, Musk and Vanilla.",https://www.fragrantica.com/perfume/Lancetti/Via-Condotti-Pour-Femme-4620.html
"Holy Water Demeter Fragrancefor women and men","for women and men",3.74,144,[],"['Francis Kurkdjian']","Holy WaterbyDemeter Fragranceis a fragrance for women and men.Holy Waterwas launched in 2009. The nose behind this fragrance is Francis Kurkdjian.",https://www.fragrantica.com/perfume/Demeter-Fragrance/Holy-Water-5967.html
"Touch of Lace Yardleyfor women","for women",4.33,3,[],[],"Touch of LacebyYardleyis a Floral Woody Musk fragrance for women.",https://www.fragrantica.com/perfume/Yardley/Touch-of-Lace-13652.html
"Blue Kalbar Ensar Oudfor women and men","for women and men",4.51,39,"['floral', 'woody', 'animalic', 'amber', 'oud', 'powdery', 'aromatic', 'fresh spicy', 'aquatic', 'musky']",[],"Blue KalbarbyEnsar Oudis a Amber Floral fragrance for women and men.Blue Kalbarwas launched in 2019.",https://www.fragrantica.com/perfume/Ensar-Oud/Blue-Kalbar-53758.html
"Toi Mon Demon Des Filles a la Vanillefor women","for women",3.83,6,"['woody', 'citrus', 'powdery', 'warm spicy', 'aromatic', 'fresh spicy']",[],"Toi Mon DemonbyDes Filles a la Vanilleis a Woody Aquatic fragrance for women.Toi Mon Demonwas launched during the 2000's.",https://www.fragrantica.com/perfume/Des-Filles-a-la-Vanille/Toi-Mon-Demon-9872.html
"Snowy Sun Oakchafor women and men","for women and men",4.8,5,"['white floral', 'amber', 'citrus', 'powdery', 'vanilla', 'rose', 'musky', 'floral', 'sweet']",[],"Snowy SunbyOakchais a fragrance for women and men. Top notes are Carrot Seeds and Bergamot; middle notes are Orange Blossom, White Flowers, Jasmine and Rose; base notes are Labdanum, Vanilla and Benzoin.",https://www.fragrantica.com/perfume/Oakcha/Snowy-Sun-93063.html
"You're The One Diamond Shimmer Bath & Body Worksfor women","for women",4.44,9,"['rose', 'sweet', 'fruity', 'woody', 'floral']",[],"You're The One Diamond ShimmerbyBath & Body Worksis a fragrance for women.You're The One Diamond Shimmerwas launched in 2021.",https://www.fragrantica.com/perfume/Bath-Body-Works/You-re-The-One-Diamond-Shimmer-78911.html
"Romeo Toni Cabalfor women and men","for women and men",4,1,"['woody', 'fresh spicy', 'aromatic', 'citrus', 'earthy', 'patchouli', 'warm spicy']","['Toni Cabal']","RomeobyToni Cabalis a Aromatic Spicy fragrance for women and men.Romeowas launched in 2019. The nose behind this fragrance is Toni Cabal. Top note is Bergamot; middle note is Black Pepper; base notes are Cedar, Vetiver and Patchouli.",https://www.fragrantica.com/perfume/Toni-Cabal/Romeo-81083.html
"Floralie Creedfor women","for women",4.08,79,"['white floral', 'floral', 'fresh', 'tuberose', 'green', 'woody', 'aromatic', 'rose', 'musky', 'sweet']","['Olivier Creed']","FloraliebyCreedis a Floral fragrance for women.Floraliewas launched in 2018. The nose behind this fragrance is Olivier Creed. Top notes are Lilac, Tuberose, Tagetes and Bulgarian Rose; middle notes are Lily-of-the-Valley, Cedar and Amber; base notes are Cedar, Musk and Amber.",https://www.fragrantica.com/perfume/Creed/Floralie-50211.html
"Cardamom & Khyphi DSH Perfumesfor women and men","for women and men",4.54,28,"['warm spicy', 'woody', 'earthy', 'aromatic']","['Dawn Spencer Hurwitz']","Cardamom & KhyphibyDSH Perfumesis a Amber Spicy fragrance for women and men. The nose behind this fragrance is Dawn Spencer Hurwitz.",https://www.fragrantica.com/perfume/DSH-Perfumes/Cardamom-Khyphi-21072.html
"Bindi Ballet The Fragrance Kitchenfor women and men","for women and men",5,1,"['amber', 'woody', 'powdery', 'musky', 'earthy', 'citrus', 'warm spicy', 'mossy', 'patchouli', 'balsamic']",[],"Bindi BalletbyThe Fragrance Kitchenis a Amber Floral fragrance for women and men. Top notes are Bergamot, Pink Pepper and Lemon; middle notes are Myrrh, Heliotrope, Styrax and Amber; base notes are Patchouli, Musk, Oakmoss and Cedar.",https://www.fragrantica.com/perfume/The-Fragrance-Kitchen/Bindi-Ballet-45985.html
"Jawhara Maïssa Parfumsfor women and men","for women and men",3.91,82,"['citrus', 'amber', 'white floral', 'vanilla', 'patchouli', 'woody', 'powdery', 'sweet', 'animalic', 'warm spicy']",[],"JawharabyMaïssa Parfumsis a Citrus fragrance for women and men.Jawharawas launched in 2020. Top notes are Bergamot and Lemon; middle notes are Orange Blossom and Patchouli; base notes are Amber and Vanilla.",https://www.fragrantica.com/perfume/Maissa-Parfums/Jawhara-68579.html
"Calvin Klein Women Eau de Parfum Intense Calvin Kleinfor women","for women",3.63,137,"['citrus', 'warm spicy', 'white floral', 'woody', 'aromatic', 'amber', 'fresh spicy', 'powdery', 'violet', 'patchouli']","['Honorine Blanc']","Calvin Klein Women Eau de Parfum IntensebyCalvin Kleinis a Amber Floral fragrance for women.Calvin Klein Women Eau de Parfum Intensewas launched in 2019. The nose behind this fragrance is Honorine Blanc. Top notes are Bergamot, Cardamom and Lemon; middle notes are Orange Blossom, Black Violet and Jasmine; base notes are Olibanum, Patchouli and Sandalwood.",https://www.fragrantica.com/perfume/Calvin-Klein/Calvin-Klein-Women-Eau-de-Parfum-Intense-55683.html
"Casino Royale Nights Luxury Room Freshener The Dua Brandfor women and men","for women and men",5,2,"['amber', 'woody', 'almond', 'white floral', 'musky', 'warm spicy', 'animalic', 'balsamic', 'powdery', 'nutty']",[],"Casino Royale Nights Luxury Room FreshenerbyThe Dua Brandis a fragrance for women and men. This is a new fragrance.Casino Royale Nights Luxury Room Freshenerwas launched in 2022.",https://www.fragrantica.com/perfume/The-Dua-Brand/Casino-Royale-Nights-Luxury-Room-Freshener-80803.html
"Ladon Black Phoenix Alchemy Labfor women and men","for women and men",3.67,6,"['floral', 'fruity', 'amber', 'green', 'fresh', 'fresh spicy', 'balsamic', 'musky', 'woody']",[],"LadonbyBlack Phoenix Alchemy Labis a Floral Woody Musk fragrance for women and men.",https://www.fragrantica.com/perfume/Black-Phoenix-Alchemy-Lab/Ladon-16129.html
"Rainforest Mist Skylarfor women","for women",3.76,21,"['floral', 'woody', 'fruity', 'aquatic', 'white floral', 'fresh', 'powdery', 'tropical', 'sweet']",[],"Rainforest MistbySkylaris a Aromatic fragrance for women. This is a new fragrance.Rainforest Mistwas launched in 2023. Top notes are Fig, Lotus and Kiwi Flower; middle notes are Jasmine, Water Lily and Geranium; base notes are Cedar, Sandalwood and Amber.",https://www.fragrantica.com/perfume/Skylar/Rainforest-Mist-88030.html
"Toy 2 Bubble Gum Moschinofor women","for women",3.68,"2,785","['fruity', 'sweet', 'rose', 'tropical', 'floral']","['Olivier Pescheux']","Toy 2 Bubble GumbyMoschinois a Floral Fruity fragrance for women.Toy 2 Bubble Gumwas launched in 2021. The nose behind this fragrance is Olivier Pescheux. Top notes are Candied Fruits, Bitter Orange and Lemon; middle notes are Bubble Gum, Bulgarian Rose, Blueberry, Peach, Peach Blossom, Cinnamon and Ginger; base notes are Musk, Ambroxan and Cedar.",https://www.fragrantica.com/perfume/Moschino/Toy-2-Bubble-Gum-66098.html
"L'Eau d'Issey Pour Homme Summer 2017 Issey Miyakefor men","for men",4.31,108,"['aromatic', 'fruity', 'woody', 'fresh spicy', 'citrus', 'sweet', 'tropical', 'fresh', 'earthy']","['Alberto Morillas']","L'Eau d'Issey Pour Homme Summer 2017byIssey Miyakeis a Aromatic Spicy fragrance for men.L'Eau d'Issey Pour Homme Summer 2017was launched in 2017. The nose behind this fragrance is Alberto Morillas. Top notes are Grapefruit, Kiwi and Coriander; middle notes are Pineapple and Nutmeg; base notes are Cypress and Vetiver.",https://www.fragrantica.com/perfume/Issey-Miyake/L-Eau-d-Issey-Pour-Homme-Summer-2017-45512.html
"N.48 InEstasyfor women","for women",,,"['amber', 'citrus', 'vanilla', 'rose', 'powdery', 'fruity', 'sweet', 'fresh spicy', 'floral', 'woody']",[],"N.48byInEstasyis a fragrance for women.",https://www.fragrantica.com/perfume/InEstasy/N-48-59699.html
"Colour La Rivefor women","for women",3.94,33,"['white floral', 'woody', 'vanilla', 'sweet', 'fruity', 'powdery', 'citrus', 'animalic']",[],"ColourbyLa Riveis a Floral Fruity fragrance for women. Top note is Red Apple; middle notes are White Flowers and Orange Blossom; base notes are Vanilla, Sandalwood and Olive Tree.",https://www.fragrantica.com/perfume/La-Rive/Colour-33242.html
"Sr. N Cedro Naturafor men","for men",3.92,60,"['fresh spicy', 'warm spicy', 'woody', 'citrus', 'aromatic', 'fresh', 'patchouli']","['Verônica Kato']","Sr. N CedrobyNaturais a Woody Aromatic fragrance for men.Sr. N Cedrowas launched in 2010. The nose behind this fragrance is Verônica Kato. Top notes are Citruses, Cardamom, Cinnamon and Bergamot; middle notes are Black Pepper and Nutmeg; base notes are Cedar, Patchouli and Tonka Bean.",https://www.fragrantica.com/perfume/Natura/Sr-N-Cedro-26179.html
"Zara Night Pour Homme II Sport Zarafor men","for men",3.66,111,"['lavender', 'citrus', 'fresh spicy', 'aromatic', 'woody', 'herbal', 'floral', 'powdery']",[],"Zara Night Pour Homme II SportbyZarais a Aromatic fragrance for men.Zara Night Pour Homme II Sportwas launched in 2018. Top note is Bergamot; middle note is Lavender; base note is Cedar.",https://www.fragrantica.com/perfume/Zara/Zara-Night-Pour-Homme-II-Sport-48957.html
"Amber+Smoke Michael Malul Londonfor men","for men",4.45,42,"['sweet', 'mossy', 'smoky', 'earthy', 'white floral', 'woody', 'warm spicy', 'vanilla', 'amber', 'tobacco']","['Ilias Ermenidis']","Amber+SmokebyMichael Malul Londonis a fragrance for men. This is a new fragrance.Amber+Smokewas launched in 2022. The nose behind this fragrance is Ilias Ermenidis. Top notes are Saffron, Orange Blossom and Lemon Zest; middle notes are Amber, Egyptian Jasmine and Tobacco; base notes are Sugar, Oakmoss, Smoke, Tobacco and Pine Tree.",https://www.fragrantica.com/perfume/Michael-Malul-London/Amber-Smoke-87685.html
"La Nuit Pour Femme Aurora Scentsfor women","for women",5,1,"['amber', 'white floral', 'vanilla', 'tuberose', 'citrus', 'powdery', 'animalic', 'woody', 'floral', 'musky']",[],"La Nuit Pour FemmebyAurora Scentsis a Amber Floral fragrance for women.La Nuit Pour Femmewas launched in 2022. Top notes are Bergamot and Neroli; middle notes are Jasmine, Vanilla, Cedar and Rose; base notes are Amber, Tuberose, Tonka Bean, Benzoin and Musk.",https://www.fragrantica.com/perfume/Aurora-Scents/La-Nuit-Pour-Femme-93252.html
"Voyage Hiram Greenfor women and men","for women and men",4.24,63,"['amber', 'vanilla', 'powdery', 'citrus', 'leather', 'musky', 'fresh', 'animalic']","['Hiram Green']","VoyagebyHiram Greenis a Amber fragrance for women and men.Voyagewas launched in 2015. The nose behind this fragrance is Hiram Green. Top note is Citruses; middle notes are Amber and Suede; base note is Vanilla.",https://www.fragrantica.com/perfume/Hiram-Green/Voyage-32499.html
"L'amour ALT. Fragrancesfor women and men","for women and men",,,[],[],"L'amourbyALT. Fragrancesis a fragrance for women and men.",https://www.fragrantica.com/perfume/ALT-Fragrances/L-amour-87039.html
"Commander Avonfor men","for men",,,"['woody', 'amber', 'mossy', 'earthy', 'powdery']",[],"CommanderbyAvonis a Amber Woody fragrance for men.Commanderwas launched during the 1990's.",https://www.fragrantica.com/perfume/Avon/Commander-82177.html
"Asswan Bouquet Ausmane Parisfor women and men","for women and men",,,"['white floral', 'floral', 'fruity', 'amber', 'woody', 'tuberose', 'rose', 'yellow floral', 'animalic', 'green']",[],"Asswan BouquetbyAusmane Parisis a fragrance for women and men.Asswan Bouquetwas launched in 2019. Top notes are Jasmine Sambac, Chinese Osmanthus and Orange Blossom; middle notes are Tuberose, Apricot and Rose; base notes are Narcissus, White Cedar Extract and Amber.",https://www.fragrantica.com/perfume/Ausmane-Paris/Asswan-Bouquet-77232.html
"Night Scented Stock Penhaligon'sfor women","for women",3.9,268,"['warm spicy', 'powdery', 'white floral', 'vanilla', 'woody', 'yellow floral', 'sweet', 'cinnamon', 'violet', 'floral']",[],"Night Scented StockbyPenhaligon'sis a Amber Floral fragrance for women.Night Scented Stockwas launched in 1976. Top notes are Clove and Cinnamon; middle notes are Ylang-Ylang, Lily, Heliotrope, Violet and Jasmine; base notes are Tonka Bean, Benzoin, Musk, Sandalwood, Vanille, Vetyver and Patchouli.",https://www.fragrantica.com/perfume/Penhaligon-s/Night-Scented-Stock-9193.html
"Bayrak LELASfor women and men","for women and men",5,2,"['white floral', 'citrus', 'woody', 'floral', 'mossy', 'musky', 'fresh', 'powdery', 'earthy', 'fruity']",[],"BayrakbyLELASis a Floral Fruity fragrance for women and men.Bayrakwas launched during the 2020's. Top notes are Bergamot and Peach; middle notes are Orange Blossom, Jasmine and Peony; base notes are Woody Notes, Musk and Moss.",https://www.fragrantica.com/perfume/LELAS/Bayrak-90044.html
"Les Sorbets de Bella Nina Riccifor women","for women",4.05,198,"['aromatic', 'green', 'fruity', 'citrus', 'fresh spicy', 'woody', 'sweet', 'sour', 'violet']","['Sonia Constant']","Les Sorbets de BellabyNina Ricciis a Floral Fruity fragrance for women.Les Sorbets de Bellawas launched in 2019. The nose behind this fragrance is Sonia Constant. Top notes are Rhubarb, Grapefruit, Pomegranate and Green Mandarin; middle notes are Shiso, Violet and Rose; base note is Woody Notes.",https://www.fragrantica.com/perfume/Nina-Ricci/Les-Sorbets-de-Bella-53577.html
"Lotus Shadow La Perlafor women","for women",4.28,32,"['floral', 'musky', 'powdery', 'woody', 'citrus', 'rose', 'green', 'ozonic', 'aquatic', 'fresh spicy']",[],"Lotus ShadowbyLa Perlais a Floral fragrance for women.Lotus Shadowwas launched in 2015. Top notes are Lotus, Bergamot and Pink Pepper; middle notes are Green Tea, Rose and Osmanthus; base notes are Musk, Sandalwood and Mate.",https://www.fragrantica.com/perfume/La-Perla/Lotus-Shadow-30422.html
"Goldwinner Jean-Pierre Sandfor men","for men",5,1,[],[],"GoldwinnerbyJean-Pierre Sandis a fragrance for men.",https://www.fragrantica.com/perfume/Jean-Pierre-Sand/Goldwinner-27926.html
"Classique Pin Up Jean Paul Gaultierfor women","for women",4.13,360,"['citrus', 'white floral', 'sweet', 'warm spicy', 'vanilla', 'powdery', 'fresh', 'amber', 'animalic', 'soapy']","['Fabrice Pellegrin']","Classique Pin UpbyJean Paul Gaultieris a Amber Vanilla fragrance for women.Classique Pin Upwas launched in 2020. The nose behind this fragrance is Fabrice Pellegrin. Top notes are Ginger and Citron; middle notes are Orange Blossom and Marshamallow; base notes are Vanilla and Amber.",https://www.fragrantica.com/perfume/Jean-Paul-Gaultier/Classique-Pin-Up-58769.html
"Tous Man Tousfor men","for men",3.7,222,"['citrus', 'fruity', 'warm spicy', 'sweet', 'fresh spicy', 'woody', 'fresh', 'amber', 'powdery', 'musky']","['Gilles Romey']","Tous ManbyTousis a Amber fragrance for men.Tous Manwas launched in 2004. The nose behind this fragrance is Gilles Romey. Top notes are Ginger, Sichuan Pepper, Brazilian Orange and Grapefruit; middle notes are Campari, Red Apple and Pineapple; base notes are Sandalwood, Tonka Bean, White Musk, Cedar and Amber.",https://www.fragrantica.com/perfume/Tous/Tous-Man-2644.html
"1982 Legacyfor women and men","for women and men",4.5,2,"['fruity', 'sweet', 'woody', 'musky', 'earthy', 'citrus', 'yellow floral', 'white floral', 'rose', 'patchouli']",[],"1982byLegacyis a Aromatic Aquatic fragrance for women and men. This is a new fragrance.1982was launched in 2024. Top notes are Dried Fruits, Bergamot, Rhubarb and Anise; middle notes are Ylang-Ylang, Gardenia, Rose and Pear; base notes are Patchouli, Oakmoss, Leather and Musk.",https://www.fragrantica.com/perfume/Legacy/1982-91932.html
"Massimo Massimo Duttifor men","for men",4.2,35,"['aromatic', 'woody', 'fresh spicy', 'citrus', 'warm spicy', 'green', 'powdery', 'herbal']","['Ramon Monegal']","MassimobyMassimo Duttiis a Woody Aromatic fragrance for men.Massimowas launched in 1992. The nose behind this fragrance is Ramon Monegal. Top notes are Amalfi Lemon, Mint, Thyme, Tarragon, Lavender, Galbanum, Mandarin Orange and Bergamot; middle notes are Geranium, Cardamom, Juniper Berries and Cinnamon; base notes are Sandalwood, Virginia Cedar, Patchouli and Musk.",https://www.fragrantica.com/perfume/Massimo-Dutti/Massimo-11890.html
"Adorable Rasasifor women","for women",4.05,41,"['citrus', 'green', 'mossy', 'fruity', 'rose', 'woody', 'earthy', 'fresh spicy', 'powdery', 'floral']",[],"AdorablebyRasasiis a Floral Fruity fragrance for women. Top notes are Bergamot, Green Leaves and Mandarin Orange; middle notes are Rose, Peach, Jasmine and Litchi; base notes are Oakmoss, Musk and Cedar.",https://www.fragrantica.com/perfume/Rasasi/Adorable-26406.html
"Flanerie Dans La Verger Jeanne en Provencefor women","for women",3.89,93,"['fruity', 'sweet', 'fresh', 'aquatic', 'green', 'rose', 'citrus', 'fresh spicy', 'yellow floral']",[],"Flanerie Dans La VergerbyJeanne en Provenceis a Floral Fruity fragrance for women.Flanerie Dans La Vergerwas launched in 2012.",https://www.fragrantica.com/perfume/Jeanne-en-Provence/Flanerie-Dans-La-Verger-16912.html
"Rose Sublime Les Senteurs Gourmandesfor women and men","for women and men",3.57,23,"['rose', 'aquatic', 'amber', 'woody', 'fresh', 'floral', 'warm spicy', 'honey']",[],"Rose SublimebyLes Senteurs Gourmandesis a Floral Fruity fragrance for women and men.Rose Sublimewas launched during the 2000's.",https://www.fragrantica.com/perfume/Les-Senteurs-Gourmandes/Rose-Sublime-43191.html
"Imperial Oud Junaid Jamshedfor men","for men",4.56,27,"['leather', 'amber', 'animalic', 'vanilla', 'powdery', 'woody', 'musky', 'patchouli', 'balsamic', 'smoky']",[],"Imperial OudbyJunaid Jamshedis a Amber Woody fragrance for men.Imperial Oudwas launched in 2019.",https://www.fragrantica.com/perfume/Junaid-Jamshed/Imperial-Oud-63658.html
"Neon Noir for Him JAFRAfor men","for men",4,1,"['green', 'warm spicy', 'aromatic', 'fresh', 'herbal', 'soft spicy']",[],"Neon Noir for HimbyJAFRAis a Aromatic Fougere fragrance for men.Neon Noir for Himwas launched in 2021. Top note is Ginger; middle note is Sage; base note is Palm Tree.",https://www.fragrantica.com/perfume/JAFRA/Neon-Noir-for-Him-82269.html
"Lucky Me Intense Avonfor men","for men",3.55,29,"['fresh spicy', 'citrus', 'warm spicy', 'amber', 'woody', 'aromatic', 'fruity', 'herbal', 'earthy']","['Carlos Viñals', 'Nathalie Benareau']","Lucky Me IntensebyAvonis a Woody Aromatic fragrance for men.Lucky Me Intensewas launched in 2020. Lucky Me Intense was created by Nathalie Benareau and Carlos Viñals. Top notes are Sichuan Pepper, Mandarin Orange and Apple; middle notes are Cinnamon Leaf, Nutmeg and Rosemary; base notes are Vetiver, Amber and Patchouli.",https://www.fragrantica.com/perfume/Avon/Lucky-Me-Intense-63196.html
"Al Oudh Al Mumaiz Rasasifor women","for women",3.5,8,"['oud', 'woody', 'powdery', 'musky', 'vanilla', 'amber', 'warm spicy']",[],"Al Oudh Al MumaizbyRasasiis a Amber fragrance for women. Top notes are Agarwood (Oud) and Floral Notes; middle notes are Precious Woods and Amber; base notes are Agarwood (Oud), Sandalwood, Musk and Vanilla.",https://www.fragrantica.com/perfume/Rasasi/Al-Oudh-Al-Mumaiz-8693.html
"Oud Zen Areej Le Doréfor women and men","for women and men",4.41,44,"['oud', 'amber', 'warm spicy', 'woody', 'powdery', 'leather', 'musky', 'balsamic', 'animalic', 'aromatic']","['Russian Adam']","Oud ZenbyAreej Le Doréis a Woody fragrance for women and men.Oud Zenwas launched in 2017. The nose behind this fragrance is Russian Adam. Top note is Agarwood (Oud); middle notes are Indian Oud and Indian Saffron; base notes are Myrrh, Castoreum, Sandalwood, Tolu Balsam, Vetiver and Synthetic Civet.",https://www.fragrantica.com/perfume/Areej-Le-Dore/Oud-Zen-45721.html
"CK One Collector's Bottle Calvin Kleinfor women and men","for women and men",4.5,2,"['citrus', 'woody', 'green', 'powdery', 'amber', 'musky', 'aromatic', 'fresh spicy', 'warm spicy', 'floral']","['Alberto Morillas', 'Harry Fremont']","CK One Collector's BottlebyCalvin Kleinis a Citrus Aromatic fragrance for women and men.CK One Collector's Bottlewas launched in 2011. CK One Collector's Bottle was created by Alberto Morillas and Harry Fremont. Top notes are Green Notes, Mandarin Orange, Bergamot, Lemon, Pineapple, Papaya and Cardamom; middle notes are Rose, Nutmeg, Jasmine, Lily, Freesia, Violet and Orris Root; base notes are Sandalwood, Amber, Musk, Cedar, Green Accord, Green Tea and Oakmoss.",https://www.fragrantica.com/perfume/Calvin-Klein/CK-One-Collector-s-Bottle-62846.html
"Red Mind Zarafor men","for men",3.67,21,"['aromatic', 'fresh spicy', 'fruity', 'rose', 'green', 'fresh', 'woody', 'herbal', 'earthy', 'warm spicy']",[],"Red MindbyZarais a Aromatic fragrance for men.Red Mindwas launched in 2019. Top note is Apple; middle note is Geranium; base note is Vetiver.",https://www.fragrantica.com/perfume/Zara/Red-Mind-57596.html
"Cepes and Tuberose Aftelierfor women and men","for women and men",4.02,45,"['earthy', 'tuberose', 'white floral', 'woody', 'rose', 'amber', 'animalic', 'balsamic', 'warm spicy', 'green']","['Mandy Aftel']","Cepes and TuberosebyAftelieris a Floral Woody Musk fragrance for women and men. The nose behind this fragrance is Mandy Aftel. Top note is Brazilian Rosewood; middle notes are Tuberose and Rose; base notes are Boletus edulis and Benzoin.",https://www.fragrantica.com/perfume/Aftelier/Cepes-and-Tuberose-14643.html
"Squeeze of Pineapple Victoria's Secretfor women","for women",4.2,10,"['fruity', 'floral', 'sweet', 'tropical', 'fresh', 'fresh spicy', 'musky']",[],"Squeeze of PineapplebyVictoria's Secretis a Aromatic Fruity fragrance for women.Squeeze of Pineapplewas launched in 2018.",https://www.fragrantica.com/perfume/Victoria-s-Secret/Squeeze-of-Pineapple-65381.html
"Maserati Centennial Polo Tour La Martinafor men","for men",4.04,49,"['citrus', 'fresh spicy', 'woody', 'powdery', 'green', 'violet', 'aromatic', 'amber', 'fresh', 'musky']","['Maurizio Cerizza']","Maserati Centennial Polo TourbyLa Martinais a Citrus Aromatic fragrance for men.Maserati Centennial Polo Tourwas launched in 2014. The nose behind this fragrance is Maurizio Cerizza. Top notes are Bergamot, Nutmeg and Mandarin Orange; middle notes are Violet and Ivy; base notes are Incense, Musk, Vetiver and Patchouli.",https://www.fragrantica.com/perfume/La-Martina/Maserati-Centennial-Polo-Tour-36352.html
"Smoked Vetiver Cleanfor women and men","for women and men",3.74,120,"['woody', 'aromatic', 'earthy', 'citrus', 'powdery', 'floral', 'amber', 'sweet', 'fruity', 'fresh']",[],"Smoked VetiverbyCleanis a Woody Aromatic fragrance for women and men.Smoked Vetiverwas launched in 2016. Top notes are Lemon Verbena, Pear, Bergamot, Quince and Bamboo Leaf; middle notes are Cotton Flower, Cedar and Peony; base notes are Vetiver, Woody Notes, Moss, Myrhh, Amber and Musk.",https://www.fragrantica.com/perfume/Clean/Smoked-Vetiver-35242.html
"Light Blue Dolce&Gabbanafor women","for women",3.84,"29,708","['citrus', 'woody', 'fresh', 'fruity', 'aromatic', 'musky', 'powdery', 'green']","['Olivier Cresp']","Light BluebyDolce&Gabbanais a Floral Fruity fragrance for women.Light Bluewas launched in 2001. The nose behind this fragrance is Olivier Cresp. Top notes are Sicilian Lemon, Apple, Cedar and Bellflower; middle notes are Bamboo, Jasmine and White Rose; base notes are Cedar, Musk and Amber.",https://www.fragrantica.com/perfume/Dolce-Gabbana/Light-Blue-485.html
"Sur Mon Coeur Rance 1795for women","for women",3.95,84,"['white floral', 'amber', 'sweet', 'vanilla', 'tuberose', 'yellow floral', 'animalic']",[],"Sur Mon CoeurbyRance 1795is a Amber Floral fragrance for women.Sur Mon Coeurwas launched in 2012. Top notes are Orange Blossom, Ylang-Ylang and Grasse Rose; middle notes are Tuberose, Jasmine Sambac, Rhubarb and Pink Pepper; base notes are Bourbon Vanilla, Amber, Benzoin and Tonka Bean.",https://www.fragrantica.com/perfume/Rance-1795/Sur-Mon-Coeur-16888.html
